label,review
0,送餐晚了四十分钟，到的都吃完饭了，而且点的可乐也没有给我！什么玩意啊！！！
1,来的倒是相当快，但是。。卷饼里没有酱吗？我是第一次吃。。感觉这样的饼怪怪的。。加点甜面酱会更好吃吧？两边的饼很硬，很干。。。肉太少了。。辣椒味道有点生。。。
0,这蔬菜拌饭有点
0,一次比一次体验不好，且不说送餐时间延长，其中一个菜真的不知道是用什么油炒出来的，味道实在不敢恭维。如果不打算做外卖店家可以不接单的，但是接了却做成这样，确实让人没信心继续再定了。
1,味道很辣，偏辣的
1,味道好，配送快～
0,菜品很一般，理念好，产品没搞好！
0,拌飯不好吃，尤其米飯。炒年糕還行。
0,肥肉多，汤凉了，送餐的说我没支付...
1,"卷饼不错,就是有肘子有点肥"
0,把那个送外卖的废了吧，这么懒找借口不送到楼下，什么态度么
0,"不好吃,量好少,味道还不好"
0,等了90分钟，也是醉了，这个速度无语啊。
1,送货很快，汤包好吃。
1,快递小哥很帅，很可爱，饭也很好吃！
0,"怎么就交易成功了？我都退餐了，我都打电话打到400了，怎么不退款给我,这平台怎么搞的"
0,"少小菜,少筷子"
1,这次晚了一个小时……我也是醉了
0,卷饼铝箔把嘴唇划破了，郁闷
0,里面有泥块，整个都没法吃了……
0,干锅茶树菇和上次送来的不一样，有股臭味！
1,菜挺多饭挺多就是牛肉丝质量一般
1,凉拌山竹笋特别好吃。
1,送餐太慢。。。，我觉得是太饿了，才感觉好吃。
1,味道还不错，性价比较高
1,到很好吃，就是送的比较晚
0,土豆丝很难吃
1,包装不错，手套、餐巾纸很全，味道也不错
0,送餐巨巨巨慢，口味一般~
0,海鲜焗饭不好吃
1,"用了这么长时间百度外卖，很少认真写评论，这家店真的让我有惊喜，所以认真写一个。一开始选择这家店有点纠结，20,30多一个卷饼感觉有点贵，看评论说30多的吃不了，所以就觉得20的会不会太小吃不饱。但算上满减的话，20的也就5块钱，试试吧。下单后20分钟就送到了，超级快，包着一个纸袋，卷饼被锡纸包着，应该是早就做好放着的，里面还送了一个塑料手套。卷饼相当不错，肉很多，当晚饭吃绝对够了。,很满意，下回还会买"
0,一份蝉蛹，八只，太少了吧，好晕啊
0,"配送员态度好,但是买了四种馅混杂一起不好"
1,终于吃到闻名已久的站点披萨～味道很好～
1,味道蛮不错的，包装也很喜欢
1,很大！吃的好饱
0,"能再慢点吗,我10点订的，下午1点多才到？再也不会在你家买了"
1,送餐超快，半个小时不到就送到了
0,"太咸了，盐不要钱么,,,,,,"
0,"菜一般,给的还少.,新年来了第一餐不给力啊...."
0,咬不动，给的肉还是挺多的，都是肥肉，再也不订了额
1,很好！师傅辛苦了！
0,送餐太慢了…
0,速度也太慢了，两个半小时才送到
0,代金券和满20减6有冲突么，也不说一声
1,送餐员的表现比餐本身要赞
0,绝对垃圾这次！我17:36下的订单！结果19:40才送到！商家硬是18:45才开始准备订单！以后再也不会订它家的了！绝对差评！！！差！差！差！
1,服务好速度快100分
0,"送的挺慢,菜里的汤汤水水全撒了,另外,我要的是红烧肉,怎么送来了土豆炖肉"
0,送餐太慢太慢
1,吃起来还不错
1,卡超级快就送到了谢谢谢谢
0,我要了一杯热的一杯凉的结果全是凉的，要的脱脂奶也没给我换
0,点的茴香猪肉送成了白菜猪肉的
0,建议给备注写多加米饭的多给米饭。
0,与堂食的区别好大，辣酱都已经扮进饭里了，很是无语。辣酱包都没有，还要给钱。
0,肉有点少，别的都挺好
1,好吃，希望速度加快
1,师傅服务很好.速度特别快.
0,差评，退款太慢！我说的是百度！
1,卷饼真心好吃啊！！粥和小菜也很好，送餐及时～包装严实整洁～～百度外卖免运费再减8元很给力啊！
1,第一次定披萨，送过来很快，辛苦快递小哥了，还是热的，披萨最好吃，那两份小吃估计还是在店里会好吃点
0,菜好吃，所以一直订购，但今天的米饭生硬没熟量还少，菜量也少，有点失望！
0,外卖员很辛苦，但是你们店里的汉堡真小。没法给你好评
0,快送成晚饭了。。。。
1,迅速及时！好吃！百度骑士辛苦
0,3块钱的米饭只有三分之一盒，关键是网上要说清楚，要不然不够吃，怎么弄？网上买就是为了方便，饭不够，吃不饱，还要做？太好笑了
0,味道一般。
0,"少送一份拌海带丝，,补送或者退掉都可以。"
1,"土豆肉丝比土豆丝卷好吃,因为辣一些"
0,油都溢出来了
0,肘子卷不好吃，与实物也不一样
0,饭不错，速度慢。
0,按份要的虾和肉都少，只有菜叶和油豆皮那份超级多
0,"送了一个小时四十分钟,催了无数遍,我第一次点外卖,气到发飙,垃圾正一味,我在家都差不多饿死,送到了全部汤都洒了,整个袋子都是油,这么垃圾的外卖第一次遇到,做不好外卖就不要做，垃圾！差评！这辈子都不会踏进你们店一步！恶"
0,点的馒头片没有送…希望下次能补上…
0,95分钟才送达，送达已不能吃，客服态度之差简直了
1,送餐好慢好慢好慢
0,"20-8的活动没了,不厚道。"
1,速度很快，很喜欢吃适合女生口味的
0,没有辣酱，算什么拌饭
1,这一单不错，完全满足需求
0,米饭有点馊了，红烧肉也不好吃，差评
0,两小时送到，自己体会！
0,"今天送的超慢不说,还送错了,明明点的排骨豆角给送的黄焖鸡,最讨厌吃鸡了,但是时间太长好饿还是吃了,只吃了一块,好难吃,为什么不打电话问一句给我送别的也行啊,为什么是鸡肉,太讨厌了"
0,不是肘子肉吧，而且送来的都是凉
0,菜贵，配餐费还高。真坑
0,"难吃,还一堆青菜要自己拌"
0,这单没送到好么！！自己就点完成送达了？？钱还没退好么！！
1,凉面很赞！值得回购哦！！！
0,送来时菜已凉，12元的一份青斑苦瓜，容量如外面早餐送的小菜，少的可怜
0,"太糟了。等了两个小时,牛肉我吃的快吐了,再也不可能第二次"
0,量挺大的，送餐也及时，就是同事说肉吃着有些不一样。。。
0,"味道还可以,不过送餐的时间好长"
0,肘子卷肥肉好多......
1,肉再多一点儿就更好了~
1,非常好吃，包装很严密
1,"非常快,服务好,送餐员超温馨,点个赞"
1,感觉真不错，看包装就给人干净放心样子，量也很足，不错
0,真心难吃，米饭又少，吃过最失败的一次快餐
0,今天为何没有收到饭，怎么回事
1,非常美味！！！！
0,速度啊，要快点，都快被你们饿死了
0,预计11点送达，12点半才送，送餐员没到就给我打电话，我在楼下等他五分钟，呵呵了
1,送餐速度非常快，服务态度非常好。
1,包装很好，很干净
0,"饭菜都是凉的,速度还慢，再也不会买。"
0,速度挺快的~就是有点撒了，点的抹茶拿铁太甜了……味道一般
1,"味道很好,皮薄有汤汁"
0,"大盘鸡特别坑人，几乎全是土豆。仅有的几块鸡肉都是骨头,脖子之类的，根本没什么纯肉，简直就是糊弄人"
0,备注里重复了三遍不要葱不要葱，等了一个多小时送过来的还是带大葱的！！这让人怎么吃？？
1,快递小哥很给力，送的非常快！
0,又一次没筷子，不过快递员服务很好，只能说店家太不细致了。味道也很一般
0,时间慢就不说了，咖啡洒得一塌糊涂，估计提着跑了好几家了。真够烂了
1,包装很用心，而且还送了手套，味道不错
1,量多味美，送餐大叔还给送上楼了，以后还来，好评
0,我订的外卖，我还订了一根肠，送到了只有饭，肠没了，是不是送餐人员的疏忽呢？
1,量少，味道不错，微贵
0,"真的醉了,鸡丝凉面好几块生的不说还咬不动,面巨硬,基本没吃就扔了,皮蛋瘦肉粥特咸,我真是醉醉的"
0,太一般了，这个价钱不值
0,说好的不放青椒，还是放了，不过还好我同学吃青椒。
0,咋的跟饿了吗不一样的名，坑爹
0,使劲催还一个半小时才送到，煎饼和豆浆都凉了
0,送的很快，包装也专业，就是面很不好吃，没嚼劲，象是挂面，不象原来那么好吃。
0,分量太小了
0,辛苦送餐师傅。肉夹馍一直都很好吃。
0,送餐人员态度恶劣，等了超过一个半小时，送来以后还骂人，叫过这么多次外卖从没见过这种送餐人员
1,送餐很快，大熱天，辛苦配送師傅了
0,太可恶了，不送还接单，催了几百遍都不理客户，从没碰到过这么恩劣的商家
1,速度快好多！
0,煲仔饭量少
0,1送餐时间非常不准，不管是提前送还是迟送，2西红柿鸡蛋太咸，打死卖盐的了，3买炸酱面也不送汤了
0,太慢。。。1个半小时才送到。
0,鸡蛋没有熟！！！
0,"等了两个小时,没按时送,饭都凉了,人也饿过劲了,菜也凉了,不好吃,以后不会再叫"
0,味道还可以，就是送餐很慢很慢很慢，第一次等了快两个小时，第二次一个半小时。
0,卷饼味道很一般很一般，不好吃，但是便宜
0,等了两个半小时才到。
0,真的巨难吃
0,吉吉熊从来都不看备注的，从来不给勺子，说了一万次要勺子一次都不给的，还让我凑合。一次不给勺子我凑合就算了，这已经是我第三次订餐写了要勺子不给勺子了！我的订单记录每次都写了要勺子从来都不看这是最后一次了，下次再不给勺我退订！我是忍不了了，谁爱忍谁忍去。
0,必须要给差评！！！！！！！一直特别喜欢吃这家，订了好多次了，结果今天等了两个多小时，催了两次才送！！！催单时候店家态度也不好！！我都下班了，还得在这等外卖！！送餐的还特别蛮横，说慢是店里问题，和他一点关系没有，让我找店里去！！请的都什么快送餐员！！！！
0,订单上有饮料，送来的却没有.菜一般，送饭一个小时左右
0,真是烧饼啊……上面啥都没，怪不得没配图呢！！！
1,味道不错，就是送餐慢了点。下面那个叶良晨网络看多了吧，幼稚儿童一枚
1,菜品一直都很美味。百度外卖的送餐师傅们真辛苦，每次送餐还都不忘说一句:祝您用餐愉快。必须给个大大的赞啊！百度外卖会越来越好的(^_^)
0,咖啡都洒出来了，杯子都湿了
1,"都很好吃,可是沙拉里面有一颗肉虫,差点就吃进去了…,希望店家洗菜注意"
0,量少不好吃，其中葱油拌面成一坨了！
1,挺好的，油稍微有点多。
1,不错不错不错
1,"非常好,素拌分量刚好一人吃，奶茶略甜了些，但有普洱味道，挺好喝的。,送餐小哥很有礼貌"
0,很快，就是没发票
0,首先那么一小碗还不热的泡菜汤！酸的要命颜色看着水不剌激的！一碗没多大还给半碗！小盒泡菜已经馊了！本来想换换口味人家韩国人做的泡菜汤也没有那么酸根喝醋一样！以后也不会再点！米饭也不热！沙拉还可以吃！一肚子气也不让我传照片！让别人也看看！泡菜我咽下去了明天拉肚子我还得找你们呢
0,我要的小菜是裙带菜，为什么送的是花生，百度外卖不看备注？别的外卖送的和订单要的不一样还会告知一声！！
0,"量太小了,那么大一盒就几块"
0,"等了一个半小时餐送错,菜已经凉了"
0,接线员的服务态度差，都不敢打电话咨询了，其他方面很好
0,速度快，吃的时候没感觉，当天凌晨4点上吐下泻！请问你们是放啥药了？
0,10.40定的，11.50到的，真是服了气了，黄焖鸡吃的像红烧鸡块，不说了，绝对不在这里点了
0,"来这里吃过多次,这次接电话的服务员态度特别差,中午1点多下的单,订4点的外卖,打电话过去,服务员告诉我在那里吃过了,还一副都是我的错的样子,那态度都让人无语了！"
0,"不想说什么了,给的少得可怜"
1,没想到这么好吃，好评！！！
0,石锅拌饭味道一般
1,"不错,好吃"
0,送到速度慢，菜一般
0,送餐的人什么态度，摆一副臭脸给她妈谁看啊
0,饭菜都已经凉了
1,很好吃，包装很可爱，么么达
0,"太差了,麻辣烫就一点点菜,全部都是粉条子"
1,便宜，实惠
0,"太难吃了,已经想不到用什么词,来形容难吃了"
1,说好的豆瓣酱哪去了，忘了吗？
0,等的时间太长，当然，今天下雨，不过您的电话也应该畅通呀，打了那么多遍都是语音。。。害得我又点了一份～
0,送的太慢啦
0,还可以就是有点辣
0,涨价拉、就不想吃拉
1,挺好，继续保持！
0,太垃圾了，根本没给送货，还显示14点14完成订单，还不知道什么时候才能退款，太气愤了，百度客服也敷衍了事
0,太慢，等了一个小时
0,肉夹馍不错，羊肉泡馍酱肉包很一般。凉面没想象中好吃。送餐倒是很快。
1,太慢啦！80多分钟才送到！
0,这次的排骨极其不新鲜！
0,都是鸡杂，黄焖鸡里面不知道是什么，比杨铭宇差远了
0,"还可以吧,薯条好吃,！"
0,海带烧肉真心吃不了，海带居然是酸的，都没吃，其他倒还不错。
0,太差劲了~送餐晚了就算了，还让人自己去取餐，是你送外卖还是我送的，自己下去，还订餐做什么！
0,慢到无可救药，还洒的袋子湿透。累感不爱
0,大份的麻辣烫还这么这么这么少！好意思么！！！18和22的也没区别吖！！！！！！
0,等了一个半小时餐才到，餐都完全凉了。菜也很油。商家电话永远打不通。不会再点了。
0,一单元和二单元分不清...麻烦
1,还是一样的好吃，全吃掉了！
0,西红柿和黄瓜不能放到一起煮！厨师这点常识都没有吗？
0,美式洒了半杯！星冰乐不给吸管！我怎么喝！
0,菠萝包不给黄油是几个意思
1,配送费越来越贵！！！！
0,不是一般的慢啊，快仨小时才到，不过素的卷饼还是挺好吃的，送餐太慢，感觉以后不会来了快～
1,羊肉稍微有点干，其它还好
0,不仅特别慢！而且宫保鸡丁都馊了！
0,奶盖红茶送成柠檬红茶，给你们打电话后说要给我回话然后等到现在也没有
1,菜不错，但送的实在太慢了……
1,很给力！便宜好吃
0,汤居然给我送来的是调料包让我自己拿开水冲
0,里面竟然有大片肥肉皮，说好的鸡肉卷啊。。。
0,肉少菜多，菜好像不太新鲜，皮蛋瘦肉粥还可以便宜点，送餐还挺快
0,皮蛋瘦肉粥不错，土豆肉丝盖饭就呵呵了
1,时间有点久，不过总体都还好
0,难吃到爆！就鱼香肉丝的还好！
1,严寒天，快递哥好辛苦，秒速送达，好温暖，真心谢谢
1,有点辣，送来时有点凉了，其他还好
1,"不错,满意"
1,挺好吃的额，继续加油↖(^ω^)↗
0,竟然不给餐具！
0,少我一个菜酸辣瓜条，投诉也没人理我
0,凉拌米线能吃吗？餐馆出新品种不试吃吗？无语！
0,"首先送餐时间过长，十点半左右下的订单，系统显示11:20送达，实际送达时间为12:40,其次，配餐有误，我定的是全素饼送来的是全素饭"
1,京酱肉丝有味道啊。坏了吧。
0,送的很快，就是不好吃，面里菜太少了，就两小片油菜叶子～
0,等了两个小时，可以当夜宵吃了
0,送错了，没有美式，给了个小拿铁....
0,很好！很实惠！
1,"挺好味道比较淡,还好给了盒榨菜,还不错"
0,速度慢的，还能再慢点呢，还有果汁哪去了呢……
0,没有赠加多宝
0,也就那样，不好吃
0,太辣，备注少辣没用…………
0,等了2个小时15，让我去一楼取，等了10分钟，也打不通电话，看不见人，都一点半了送过来，还让我下楼去取！以后坚决不定
0,"太慢了,等了一个半小时，中号卷饼很大，有点辣，肉给的很多，没有酱？味道一般，南瓜粥没有味道也不甜。"
0,开餐具袋的时候，你们餐具袋里锋利的牙签把同事的手都戳出血了，可惜不能上传图片……
0,都说了，面和卤分开的！每回都忘！！！！
0,一个多小时了根本没做，打电话询问，还骗人说已经在路上了，绝对差评
0,"东西不错,就是送餐时少给了两个煎饼,结果又等了一个小时才来的,同事已饿晕"
1,挺好的，配送速度非常好
0,定了两份奶油蘑菇汤，收到货发现撒在袋子里一份，本想投诉的。牛肉炒饭贵，您就货真价实呗，结果配菜少，牛肉可以安粒数，全是米饭。
1,饼边走点硬，味道还不错，希望下次改进。
1,下次记得给我带肘子里的醋
0,等了半小时，送错餐了…不知道把谁的拿来了…又等了半个多小时才送来对的…都快饿死了！
0,"送了三个小时,我也服气了,开始刚来公司没注意直接选立即送餐了还觉得太早了,可是没想到还是订晚了"
0,很失望，不好吃。
1,"很不错,很好吃"
0,超时不少，饿坏了
0,太难吃了，真的想不出还有什么能形容的，涩，难看，胡味儿
1,配送服务非常好，稻香村很好吃
0,差得不行。让我等了两个小时才送到，距离就一站地，送到了餐已经凉透了。过了一个小时给客服打电话后，店里才给我来电话，说送餐人员不够，不够你特么送什么外卖呀？
0,质量变差了，因为定的太多了？
0,加两种荤菜但是只给了一个
0,送餐费用怎么回事。要了我十块钱送餐费，大雨天的不差送餐员的确辛苦，但是能不能透明消费！
1,❀⚘送༵来༵不༵是༵很༵凉༵了༵但༵味༵道༵还༵是༵不༵错༵的༵⚘❀
0,送菜太慢，过了高峰时段人都走了，一个多小时还没送到，电话取消后，不知怎么退款
0,不是一般的慢，1.30才到。再也不会来了
0,"太慢了,慢的不行,而且外卖肉少的可怜"
0,接电话的小妹态度很不好。
1,饼真心不是我想吃的那样的
0,差评，差评，差评！！！！！！！！都没给送餐，把钱退给我行吗？以后再也不定了！！！
0,能不能到了再打电话，害的我非得在楼下等半天
1,都好吃，经常点他家的外卖(^_^)
0,竟然悄悄涨价，素三鲜味道一般，备注了也没给醋和辣椒
0,味道一般，而且少到可怜。
1,送餐送错了，送来三种不同口味总计19个小笼包，也是醉了
0,之前晚归晚，至少还能接受，这可好，11点20订，两个多小时才到，送来了都该上班了，都没有时间吃了，下次不敢订了
0,您的意见很重要！口味如何？服务怎样？来点评一下吧！
1,薯条很大很好吃！送餐快！
0,餐品未按照要求去制作，里面包的肉也非常少，比在店里买的产品质量低
1,味道比以前有改善！
0,鱼香肉丝不是那么正宗啊，味道好平淡。。。
0,20元套餐送来的时候都洒了，有一个明显滥竽充数
0,态度太差！
1,很好吃，速度也快，小笼包汤汁很多，味道不错
0,"唉,送过来一份饭,都没地方放,里面的汤全撒出来了,直接扔了"
0,汤和面不是分开的，面都糊了，不好吃。
1,非常快，非常好，没啥说的
1,不错挺好吃
0,菜不错，快递不给力，就一个师傅，给人累的够呛。
1,一切都好好，味道也不错，只是点了肘子的送过来两个鸡腿肉的，因为太晚了也不折腾了，只是没吃到肘子的卷饼好遗憾呢，另外南瓜粥也没有改的王老吉…太晚点餐就是不好啊
0,你给我放了一罐辣椒油吧，还有麻油，麻死我了。怎么吃啊
1,莴笋和烟笋什么区别？我点的是绿色的那种青笋怎么给我送个黑色的请问哪个菜名是砂锅里绿色的青笋
1,太快了，送的！
1,送货速度挺快的
0,真的太慢了，迟到一小时，所有菜都凉透了
1,送餐员非常快，联系了好几次非常好
0,到现在也没有收到。从12点说送一直到现在
0,鱼籽都散了！量少！不过味道也可以！
1,很棒！下次还来！
0,好几次十点半定餐，都是一点送到、速度太慢、差评！耽误事、
0,吃完昨晚到现在一直闹肚子，确定现做的？跟第一次差好多！
0,两个小时才送到！
1,骑士精神~非常好！又快！！！
1,一个小时送到的，很好吃，但是点了平菇怎么没给
0,真难吃，肉上还有毛
0,我要去百度外卖投诉，送到海泰大厦2个小时，我也是醉了，菜都凉了，还打电话让去楼下取，送餐费不是收了吗？
0,"卷饼挺好吃的,就是送的太慢,快两个小时了"
0,又少给了烤肠无语
0,"巨慢,巨少,巨难吃"
0,汤都洒得差不多了，泡菜汤实在不咋滴，被当家的一顿骂
0,没有筷子！！
0,满三十为啥没优惠了。
0,米饭忘记，餐具只给一套。极其不认真，辛苦快递员！
0,米里有石籽，硌到牙了。。。
0,买的红柚，送来的确是白柚
0,一个小时才送到，面坨成个疙瘩，没法吃，扔了
0,"菜里竟然有不知道是锅,还是,盘子的碎片,太过分了！！！！"
0,难吃得要命！
0,时间也太久了，还不是用餐高峰，足足等了两个小时。
0,非常慢，非常难吃
1,肥肉略多啊
1,不错不错，速度很快
0,"口味能再重一点吗？大料不用钱买？不喝三杯水,我是吃不下去的"
1,说好不要蒜的，结果两次都有蒜，简直太过分了！！！~~~以后不准备买了，有也不通知一下。
0,海带丝着实好吃。送外卖的小哥给洒了。满袋子都是那个汁。那个菌菇汤就是坑。居然是速冲的！还巨难喝。
0,1个半小时才送到，可想而知饭菜已经凉了！凉凉的！！
0,点一次吃到一次头发究竟是为什么？？？
1,味道不错，出去吹风的时候正好碰上外卖小哥。
1,不错，好吃不贵，送餐速度快
0,总感觉肉有点臭臭的
1,非常神速，就是有点咸了
1,"送餐快,味道还可以,很干净"
0,少一根烤肠
0,今天有点慢哦
0,味道一般～
1,味道不错……
1,非常美味，下次还会再来！
0,垃圾别吃吃了就后悔难吃
1,很不错，饭菜量都很足
1,点了太多次了，味道很香
0,"鸭蛋都没拨壳,什么情况,太无语了,头一次吃鸭黄肉丝粥附赠蛋壳的"
1,很不错，速度挺快，就是油有点大
0,"猴子面包就给那么点奶油,无语了"
0,配送太慢了，小炒肉味道不错，干锅肥肠一般
0,包装不错，口味一般。
0,味道还可以吧。
0,物流特别慢，催了一次单，打了一次客服，评价居然显示12：50送达，你送到了吗？一点半才送到好不！等了一个多小时！
0,配送太慢，比预计的时间晚了一个小时才送到
1,一如既往地好，赞赞赞赞赞赞
0,下单2个小时才送到。无语了。
0,一个多小时才到，全撒了！！
0,不给餐具！可还行！太差了
0,太慢了，太慢了，以后坚决不定这家外卖了，10点过下的单，快1点了才送来，期间催单2词以后居然不接电话。。。只好打百度客服，味道中规中矩。唉
0,"希望可以一对一配送,中间不要再配送了！送来的不是星冰乐！就是一杯抹茶水！！！"
0,等待了105分钟，还是在投诉的情况下才送餐
1,豆腐脑再多点香菜就好了
1,"很不错的一次,下次还会到这买"
0,可乐都洒到煎饼里了...这是新口味吗?
0,骗人的，那么难吃，还卖那么贵，根本不值，米线就是方便面调料加菜，不信的话可以试试
1,"虽然时间长了些但是很准时。下次记得给些番茄酱就更好了。,一个人吃足够了。好好吃"
1,快递小哥态度特别好…辛苦啦谢谢
1,送餐快递很给力，饭菜都热着呢，鲜肉小笼包和红烧肉都不错
0,饺子太少了
1,拌面有点坨，味道很好
1,准时送达，骑士辛苦。稻香村的点心有几个一直是最爱
0,送餐的过来，米线已经撒完了，没有汤汁，哎…很失望…
1,第一次订，提前送到，吃了下才来评价，味道不错，好评
0,味道著實一般送到時候飯涼涼的
1,外面下雨还比预计时间早到，速度好评，点的菜也成功，味道不错！
0,十块钱就两个锁骨，好贵！送来的订单也不是我们的单子，就这么迷迷糊糊的怎么做生意的？
1,还蛮快的，味道也还不错，我喜欢~
0,小票上的送餐时间错了，11点就来了，我的订单是11:45的。。。。。。
0,网上订单写的31，到地方送餐员非多要我1块钱，太不专业了。然后就在我门口一顿嚷嚷，令人发指！
0,订了两份饺子，一份腊八蒜，但是腊八蒜没有送，打电话给商家问，商家没有任何致歉的意思，态度反而很不耐烦。问我怎么办，可笑你说呢，花一分钱也是我买的，你反而来问我？本来不是大事3块钱，为了凑单点的而已，有个好态度就好了。既然如此，你当然应该给我送到，我花了钱买的。但是商家居然在确定给我送的前提下，午餐点的，晚餐时间都要到了还没有送到。这样的商家我必须投诉，我已在百度投诉，我倒要看看会是什么处理结果！！
1,送餐非常快
0,粉送來的時候已經「斷」完了，跟米飯一樣，唉，有些失望⋯
1,味道很好，可惜吉野家的量一直不太多
