label,review
0,"觉得不是很好吃,略咸蛋"
0,过桥米线味道不好，竹筒饭就一点点
0,一有点慢，吃了下午就拉肚子了
0,满塑料袋的油，饮料上都是。
1,图片供参考
0,老板你家辣椒不要钱吗，全是辣椒，鸡肉被谁吃了，一份38的肉，有六块吗，肉少您整大点快也行啊，肉块小的，埋在花椒里面都找不到，您是让我吃花椒还是吃辣椒
0,我要的是香草拿铁，但是送来的是拿铁啊…
1,小炒肉太辣，其它还行
1,"师傅辛苦了，谢谢,下雪注意安全"
0,太咸了！！！
0,必须投诉！！订的早餐三个小时才送对了我要的才送去全！我早上9点订餐到现在快12点还没到！SB！这辈子再也不订你们家的餐！SB！大家都别在订他家色l
0,没按要求加浓缩，咖啡还洒的乱七八糟……
0,这也太慢了。。。蔬菜的饭味道也不怎么样。。。
0,这是我最差的一次送餐体验了。一杯可乐撒掉了五分之一，豆腐脑也从碗里溢出来了。送餐小哥是跟谁越野飙车过来的吗？同时也想问问商家，你外卖可乐那么贵就不能用听装的吗？非要装个塑料一次性杯+塑料袋，既不环保又影响卖相！
0,同样的菜品！怎么没有上次的口？不是一个厨师吧！这次没有自己炒的好吃呢？
0,送餐的骗人，说保安不让进，让我到大门口拿，我眼睁睁看着其他送餐的进来，还给送到四楼，也不是第一次叫外卖了，借口这么劣质，差评！
1,提前送达，味道不错，再接再厉！
0,肉臭了，态度还十分恶劣，必须差评
0,送的太慢了，送餐员连路都不认识。
1,很好吃很实惠～但有点不够吃，要是加送点当主食的饼就好了～
0,晚到，不认识路的送餐员
0,时间长了，筷子也没给
1,大雪天，很快送到了，态度很好。百度骑士很专业！
0,我去，怎么写了个送达？？？根本
1,送餐大叔文质彬彬的：）拯救了快饿死的我。中午赌气没吃饭忍不住点了卷饼，吃一口，整个人都活了过来呀！
0,骗人的地方，点了餐要是送不来到是说话呀，根本没人理，中午饭你下午两点送是什么意思呀
1,土豆不错，肉丝太少
1,速度非常快，味道也挺好，一直喜欢他家的皮蛋粥
0,"牛蛙是58元一块,跟青岛的龙虾一样！百度外卖要火啦！"
0,豆腐脑味道感觉很一般
1,送的有点慢，其他都挺好
0,耗费时间久，卖家态度不认真，食物不齐全，
0,橙子有一个直接是干的没任何水份了！香蕉里面黑了一根！
1,里面加肉的有些腻，下次尝尝土豆丝的~~但是超级好吃~~
0,肉夹馍不错，但是凉皮味道真不怎么样…南瓜饼也不错
0,填写了发票信息却没有开发票。负责配送调度的工作人员也不专业，都不清楚是否需要发票抬头。好的是发货快，饭菜性价比还可以
0,一份饭还不够三岁孩子吃呢
0,送过来的时候已经有些凉了，肘子变得非常油腻，吃了一半就扔了……
0,肉很足，味道还行，就是送的实在太慢了，等了两个多小时，到的时候菜都凉了。
0,店长说话很气人直接告诉送不了叫我退了！
1,"送餐很快,态度也很好,谢谢"
0,要的煎饼套餐送的油条套餐
1,配送速度很快，服务态度很好
1,百度骑士很快就送到啦！不错
1,好喝。。速度快。。。
1,非常方便早餐到家。快递小哥很好。
0,"送餐员不分东南西北,还说我不认识路"
1,味道不错，速度很快。
0,品味一般，F服U务C差K！
1,送的太快了，师傅很辛苦，谢谢了。
0,"东西略贵,那么一点牛肉26,在超市26能买好大一块酱牛肉"
1,很满意。味道好好，量还足。送餐好快，谢谢百度外卖的送餐师傅。
1,送得太慢了～味道很好
0,配送能再不准时点么，饭里全是沙子
0,送货太慢了。
0,如果没有肥肉就更好了
0,"牛肉貌似有股坏了的味道,2次注明要生菜根本没人理"
1,送的挺快的
0,订餐94分钟才送到，各种菜都没有，没有就不要接订单。
1,味道不错，肉量很足，不过感觉有些油。很贴心的附送一次性手套。
0,快递不熟悉路线分不清东南西北晚了一点，然后20元的菜居然上面贴着10元的字样，还没有之前的15元的菜丰富！只有4个菜和一点咸菜！太坑了吧！15元套餐是5个菜，刚定一次就取消了，只能定这个，活动参加就办的有样子点啊搞的变贵菜还少了，给的也超级少！
0,凉面一般额。。。。。。其他还行
1,百度小哥太有礼貌了！约17:30送餐，敲家门的时候一分不差！绝对32个赞
1,"师傅相当神速啊,好评！"
0,肉皮冻全是猪毛！恶心
1,味道一般，但是服务和饭菜质量很好！
1,土豆丝太淡了，没有滋味
0,送餐速度快，但是套餐里没有小菜是怎么回事儿！
0,慢死了，慢死了。是要等两个小时么
1,速度快，服务好，菜品更佳
1,味道还不错，红烧肉更软点就更完美啦！
0,这个饭不好吃，饮料真的太不好喝了，蛋挞是凑单的，尚可
1,肉松送成鸡柳了，赚到了
1,几乎没怎么等，就到了！包装严实，服务完美！亟待二次消费，哈哈！
0,"薯条不错,蘑菇芝士汉堡不好吃,没有很牛堡好,送餐挺快的"
1,非常好！！我家住六层，送餐人员直接就爬上来了送到家门口，态度特别好，辛苦！感谢！
0,又是没用脱脂奶，备注是白写的吗，要是觉得定的少不想代购可以干脆别代购了，郁闷啊
1,好吃而且包装的特别仔细，还送了手套，很贴心，超级满意
1,"送餐速度快,东西好吃"
1,帮朋友订的，听说不错
1,豆腐脑淡了
1,我要的是肘子的结果送来的是鸡肉的。。不过都挺好吃的，希望店家下次注意。
0,订歺后2小时才到
1,很好吃，货真价实。送货快。
1,外卖的饼有点软了，不过送餐还是比较准时的，一般都在30到50分钟之间就能送到，今天的豆浆没有糊味，赞一个！
0,你家馒头2快钱一个也就算了，可恨的是，一个馒头要一元钱包装费，合着一个馒头三元钱。这也就算了，关键你馒头来的时候就他妈用一次性塑料袋装的。不管多少个馒头，都装一个塑料袋里边，凭什么收包装费，你的包装呢？
0,香菇鸡肉的超级难吃，厨师一定打碎了盐罐子，咸的没法吃。十一点半订餐，一点多才送来。这速度也是醉了
0,一不小心点错了，一个小时十五分钟了，还没送到
0,太难吃了！
1,豆浆不错到手一点没撒而且还是热的！赞快递
0,"菜量极少，只有正常菜量1/3,只见白菜了，就一点点肉，还都是肥肉，极差!"
1,地址写错了，6楼，爬了两次给回来的，小哥人很好
0,葱40%，花生30%，肉20%，辣椒10%，IT男没有以前厚道了
0,太慢了太慢了太慢了！
0,好慢...吃得还不错
0,"又是非肥肉和海带,.....直接垃圾桶了"
0,"还可以吧,牛肉筋多有点老,泡菜还行"
1,"好吃，就是吃多了,有点腻,感觉有点淡"
1,很好吃，肉很多，料足
0,太难吃啦，量小，不好吃
0,有点凉了！！！！
1,"小清新的饮料太甜了,很不正常那种甜"
0,配送了三个小时，够了
0,"根本没送到。等一个多小时变成送达。,不知道送哪去了。"
0,送的慢而且饮料还没送
1,味道其实是大众水平，但是干净，送餐快，真的好服务
0,别的暂不说，打了四五个电话，9点多定的餐2点了早已经上班了才到手里，你可以早点说送不到啊，送到当时真想不要这份饭，都不容易，想想没必要而已，欠一个解释，我想这也是最后一次订了。希望你们也要注意，类似的错误不容发生。
0,东西很少，像半分每次都是这样失望
0,吃过最差的外卖，没有之一，就是最差
1,"土豆肉丝卷有妈妈的味道,而且今天送餐还很快,大赞"
0,送饭太慢了
1,谢谢师傅～送餐很快～辛苦您了～
0,金枪鱼超级少，还是合利屋号，土豆泥是网上那种买来泡的，不是真的土豆
1,这三样都是儿子的最爱，太好吃了呀！骑士送货速度非常快，赞一个！
0,"披萨凉了,3个小时才送来,饿的我还得出去吃饭"
1,都很好，还有优惠的
1,棒，是不是考虑办个会员卡呢
0,晚了三十分钟
0,感觉现在越来越不好吃了！
0,韭菜没洗干净吧，太牙碜
1,非常满意！！！
1,有了百度外卖以后更好了，要不然这么晚了都吃不到，老顾客了，味道不错，推荐！
0,吃了这么多次了，这次竟然有块大石头，不注意还以为是猪血，太吓人了
0,"11:35下单'14:20送到,想吃的自己掂量掂量时间！"
0,还可以，比预计时间晚了一小时到，不过还好
0,我吃过真难吃的没吃过这么难吃的。
1,太好了！！！
0,"太慢了,十一点定的"
0,没有纸巾就算了，连番茄酱也没有，如果速度快换来的是仓促，那我宁可多等几分钟
1,这次送餐很快
0,味道还是挺不错的，但是配送太差了，很多东西都洒出来了，特别是小菜，弄得哪都是汤汤水水的
0,"很不开心！点的一个包菜粉丝卷和小炒肉卷,tm给我送来的是土豆肉丝卷和土豆丝卷,非常想骂人"
0,接线员态度极其差
0,菜全撒了，盒子也裂了，就是没办法放图，下次不会在从百度外卖订了，所有的app中服务最差的一个
0,太烂了，太无语了
1,"送餐速度快到令人吃惊,10分钟！！！"
1,味道好，香，量也不少
1,味道不错呦
0,时间快，但是定了5份就给我们哪了3双筷子，而且说了吧面换成土豆粉，也没给换，量特别少，少的厉害
0,第一次觉得非常不错，后面肉给的爆少啊，根本挑不出来
0,我点的是排骨油豆角，结果一块排骨都木有，有没有搞错！
0,送餐太差了，大酱汤全撒到袋子里了，沙拉的盒子是坏的！
0,已经打了客服！送过来时候撒的不行！摩卡要撒光了！
0,"最近经常在这家店定,除了饭盒每次菜的味道差别都特大"
1,下雨天，感谢辛勤的送餐者！
1,奶茶送到有点凉了，披萨好吃
0,预计到达时间17分钟后联系的我，我已出去办事，没有吃到。
1,不错，不错，家里有人住院，用百度外卖太方便啦！
0,慢了半小时
0,太慢了，送了两个小时
0,百度配送时间过于太久，饭菜没吃头了。
1,味道确实不错，粥有点淡。下次还会点
1,挺好的，百度小哥很好，菜品也不错。
0,"外送非常非常非常慢,110分钟,我就日了狗了,味道也一般,量也很小吃不饱一个卷饼,以后不会再订了！！！！！！！！！！！！"
0,菜一般味不够
1,比老家的味道差点，不过还是好评！有时间去店里尝尝
0,没勺子没法喝粥
0,"超时半个小时，还送错东西，并且还少了两杯豆浆，最后打了十几次客服电话竟然一直没人接,呵呵"
1,好吃好吃赞赞！
0,酱油太多，黑哇哇的，要的地瓜都没有看到！
1,没想到味道这么棒，以后我就多订，请多多关照！
0,这次送的非常不新鲜！要的是蒜香送来的麻辣，菜味道很臭，不会是隔夜的吧？
0,"没给汤,饭还有点生,不好吃"
0,极少喝星巴克，但每次点都觉得产品质量和口感上不如意。如果是本着“反正是卖给有钱没品位的人喝的话”那不过是一个三流街店罢了。
0,"好不容易等到了,送错了,重新发了一份,没有看到一块肉,辣白菜是苦的买了好几次,这次是最失望的一次,送餐的是个哑巴,不会说话"
0,感觉味道一般，不是很好吃…鸡肉很老…等了两个多小时，餐才送到，以后不会再定他们家了
0,烤鸭太难吃了，根本咬不动，不过百度外卖很给力，取餐速度超快
0,"快递特别慢,来的时候方便面都不能吃了,其他的味道也不怎么好了,麻辣烫时间一长就特别不好吃"
0,"请不要把硬硬的肥肉块跟嫩嫩的肘子肉混为一谈。谢谢。,简直侮辱了肘子肉。"
0,配送要一个多小时，送到都凉了。
0,炒饭好硬，豆角太老
0,晚了半个小时，严重不靠谱，电话催了一次。
1,送餐员服务很好。很满意，
0,无敌慢！！！！！！！昨天2小时，今天依旧2个半小时都，居然还没送到
1,"排骨鸡里没有青笋么,下次放点吧"
0,外卖员没有送上楼，要求客户下楼取餐
0,菜品很一般哦，只能凑合
0,送餐慢也就算了，东西都凉了不好吃了，差
1,肘子拌饭竟然是辣的
1,"很好吃,很香,包装也不错的"
0,太慢太慢，再也不定
0,汉堡王都一个味就不说了！我足足等了68分钟才收到！！！！！！预计13：15我13：48才收到！！快递真牛逼！还两分钟超时半价时候送来了！比西天取经还困难！这种速度凭什么送餐要收5块钱？？？？？？？
0,等了2小时才到，史上最慢！米线到了都黏糊了，饭菜都凉了，服务态度极差，打了6次电话每次都说送出了。真的是无语。太差太差，没有之一。
0,可能因为是外送，量比平时在店里喝少太多了。也就大半杯。无语了
0,请问什么时候送达的？午饭到晚饭点都没有送来？付账之后就不用送饭了？
0,真怀疑是不是给我送错了，没吃过这么恶心的饭……除了荷包蛋和米饭，真的难以下口！！
0,9:24才收到我订的外卖，严重超时！汉堡已不热，只好微波加热后再食用，已变成了夜宵！食品与包装上的标识不符（两个汉堡的名字全不对），望商家能选用与食物一致的包装袋
1,味道都很好，就是终于饭点送餐慢
1,京酱肉丝太咸了，建议下次淡一点
1,"杏鲍菇肠坑啊！,就是门口2块一根的烤肠"
0,有点淡，实在量太小了
0,失误难免，，以后请注意。。
0,"这次跟前几次比起来好难吃啊,可能换厨师了吧。这次的好难吃,菜花都有点没熟,不知道吃完会不会不舒服！"
0,太咸了，没法吃。骑士礼貌。
0,"一点都不好吃,而且很难吃"
0,送餐没准！！！想送就送，不想送就不送
1,送餐速度超级快！这次订餐好成功，点的菜都好好吃。服务态度也好，牛蛙不够了给打电话确认加了大虾。
0,"裙带菜没有,送，带来很大不便"
0,"送餐慢就不说了,八宝菜里还有石块,硌得牙疼好几天"
1,不错，就是地三鲜油太大了
0,商家不把顾客留言放心上，强调不要辣椒，商家还是放了很了很多，弄的孩子无法吃，其他菜品味道不错，快递小哥很不错都送院里来了很棒！
0,粥连个勺子都没有，还凉的
0,从包装到味道总体还可以，就是小菜不怎么好吃，木耳还凑合，辣白菜根本不是那味儿！所以小菜再弄好点的话，还会多多支持！
0,"菜很便宜,也很实惠,个人认为以后不会再定了"
0,2小时啊，可怕极了
0,煎饺还不错，冷面一般
0,"冰太多,味道淡,质量一般,希望改进"
0,真是太慢了！！！我都等了两个小时了！！！
0,"这次我可要评价了，要了一个牛肉汤,要了一个大酱汤,结果,回来都是半份,气死我了,我还要下楼继续买别的吃的，因为根本不够了。花了54,还吃不饱。垃圾最后一次吃。"
1,四个人吃得很饱，要是能选择尺寸就更好了
1,速度很慢，盖饭分量小，两份估计都不够吃，习惯好评
0,11.30定餐，1.00送到，中有打了4次电话催，生气。。。永不再来。
1,"多收了2块钱,不知道为什么？"
0,送了快两个小时，直接退掉，下次不会再点，打电话也没人接
0,送餐速度真的是太慢了，太太太慢啦，将送餐时间提前到11:15后，等到12:57才送到……
0,冷面不给配调料，两点了才吃上，就算再忙服务质量也不能太差啊！没调料包一大坨干面怎么吃啊！
0,味道还行，不过可能今天太忙给漏单了比较心塞…
0,没给我送，还成交。气死我了！
0,基本不给低评价，这次是真怒了。早8点一过就下单晚到30分钟以上也就罢了，还联系不上，也不打电话说，孩子饿的不停叫唤。最后送来要的传统早餐套配错了，就一杯豆浆和咸菜。油条和豆腐脑不知所踪。也没让再补，因为已经10点了再送来就是中午饭了。真心不愉快。
0,等了将近2个小时，说电动车坏了，还待修车...汗
0,蛋糕溶掉了
0,"送餐的一个多小时才来,太慢了"
0,等了九十分钟才送到，而且实物都洒了，味道还行，就是凉了。
1,包装袋好精致，卷饼的味道也很香，就是南瓜粥没味道，可能是不合我口味吧
0,"订完餐到给我打电话接餐用了两个多小时，给我打电话接餐到见到外卖小哥用了半个小时，东西东西显然已经冰了，吃个屁啊还？,科科"
0,"送来的脊骨是臭的,打电话就给退了把钱拿回来了，老客户了,这次很失望。"
0,主要是速度慢得，没法吐槽了
1,速度很快，食品也特别棒！
0,没给酱，很难吃
0,"小葱拌豆腐竟然是日本豆腐，难吃。,蘸酱菜里放的是生白菜！醉了"
1,拉面煎饼真的吃不习惯……还不如改成辣椒酱……反正不如薄脆煎饼味道好。豆浆一致都不错，挺浓郁的。
0,挺失望的，不如想象的好吃
1,非常好非常快支持！！！
0,"晚到了半个小时,汤都漏出来了"
0,送餐速度慢，不给开发票，餐具没有，要的菠萝鸡丁结果还做错了。真不知道你家现在干什么吃的！再也不点！
0,粥坏了还送过来，一股酸味。真受不了...
1,很准时，还热着呢，满意
0,超级差评！备注了送醋结果一份都没有，投诉也没人回复。
0,点的抹茶拿铁送的普通拿铁！
1,送餐速度很快，非常好
0,"有虫子,在外面,哎"
0,点了1份九品三鲜，2份茴香猪肉，结果送了三份茴香猪肉过来！！餐具也只提供了1份！！里面的调料包，三份饺子，只有两份调料包，醋包还全洒出来了！！承诺12点15分前送到，结果还是超时了！！
1,速度真快！饭菜好！我喜欢！
0,不知道是不是忘了放盐，肉很腻，味道不太好，小菜还是不错的
0,送餐太慢，晚了半个多小时
0,真的是很难吃啊，可能口味不一样吧，我和我同学就吃了几个就不吃了
1,芋圆小丸子不甜～希望下次甜一点，真的没什么味道
0,猪肉玉米的一点都不好吃
1,"挺不错,老想吃,贵也吃,第一次吃就吃好了"
0,速度够慢的
0,"饼还不错,粥是馊的,直接扔"
1,"有点慢了,希望下次加快"
1,还是不错的
1,速度很赞，服务很好，不错
0,"肥肉太多了,真吃不动"
0,"能让我写评价的店也就你黄太吉了,上次一次点的时候,都付款了还给我取消了,也没有电话告诉我,这次第二次点,心想好歹尝一次,就在家门口对面,走路过来也就七八分钟以内,结果等了一个多小时不说,东西的味道我也是不想多说了,我真不是个挑食的人,再也不会叫了"
0,服务员态度不好，
0,"香菇鸡肉卷太咸了！！！,皮蛋瘦粥，呵呵，真的很迷你，且皮蛋是皮蛋，肉是肉，米是米。。。。"
0,"说好了是酱香的,也还特意写了不要辣,结果还是辣的,根本没法吃,全扔了"
0,现在必胜客太不细心了。定的饭又不是面给个叉子。希望下次不会再有这种错误。
0,外卖不给餐巾纸的吗？
1,"非常好,非常快"
1,不错就是洋葱没熟太辣
1,超級好吃啊！下次還要吃這家的外賣，啦啦啦啦啦啦啦啦
0,快递很快，米线一般
0,"口有点重,干煸豆角已经有些苦咸苦咸了,你们家的盐是马路捡来的么"
0,快递很好，朝鲜冷面里面有虫子，没吃
0,"饼粘糊糊的,里面的还行"
0,请关注送餐时间
0,"这次东西没少,但是为什么每次送来的汤都是凉的,昨天是勉强有点温度,今天我的是彻底凉的,你们是把剩的给我送来了么"
0,餐送来只有两盒菜两盒饭，其它什么都没有，是用手抓着吃吗？
1,非常好吃~送餐小哥好早就到了~
0,没有久久鸭店里买的新鲜
0,什锦蘑菇饭图片与送来实物的严重不符，根本没有鸡蛋。而且米饭也太少了，还这么贵，真是太失望了
0,尖椒土豆卷，全是土豆丝，大概有六七根尖椒丝，上次吃完没事，这次吃完拉肚子了，不知道是不是素拌饭的问题。
0,送餐的重来不上楼
0,居然忘了给我下单，我打电话他才给我送，两个半小时
0,其他的先不说，就服务态度，接线员工态度太差。建议以后订餐能等就等，别打人家电话催单
1,不错，经常吃
0,点了两个套餐，只给一份薯条
0,"送餐很好,吃的一般"
0,腻的伤心！建议在产品工艺上改进，解决油腻的口感问题。再这么腻人，吃一次不会吃第二次！我这是本着大众美食家的心，帮助你们改进。其实肘子本身还好，加点萝卜干酸豆角酸楚之类的去油解腻，或放在卷饼里或者单独拿个小袋装！哎吗我操的什么心啊！别太腻了！！！
0,"备注了要过凉水,不知道是配送员没说还是餐馆问题,面全部坨了没法吃了,扔掉"
0,等了两个小时。10点半下单
0,"送餐晚了很久,什么都不说了"
0,快递送的很差，餐送来以后汁洒了一袋子，根本没办法吃
1,脆皮日本豆腐还是去店里吃好吃。大爱醋溜木须！！！！牛肉馅饼太赞啦！！！！
0,红豆软饼串味了，一股超级恶心的味道，就是没在店里，在店里我必定要你们的厨师尝尝这什么玩意。
0,"不能再凉了,我点了不要辣，辣辣的青椒会不会太多了…哭昏"
0,"送餐员差评,投诉,超次"
0,粥不怎么样，少不说味道也不咋的，卖的还贵，饼还可以！
0,"20套餐,盐酥鸡,变成淀粉炸,蟹段,，没什么提前说一声,没吃饱"
0,鲫鱼汤鱼不新鲜！总体来说还可以吧！
1,可能中午点单人多，等的有点久
1,快递态度好，速度快
1,"很好吃,就是粥撒了点,等了一个多小时"
0,没给果汁榨菜，筷子也没拿。
0,第一次点怎么这么与图片不符合呢，鸡蛋没有，饮料没有，赠饮是整个外卖的活动吧，套餐本来的饮料呢
1,"挺不错的，很好,就是说好的尖椒呢，结果是青椒，一点辣味都没有"
1,卷饼很好吃！
0,难吃!!!油死了，味道烂
1,"很好,速度也很快,继续努力～～"
1,东西不错，就是慢点
1,还没吃，送了一个小时，速度有点慢
0,配送用了2小时，距离不过300米，差，太差。
0,"有点凉,饭很硬,不会再定"
0,太慢了，口味对我来说是一般。
0,一个半小时才送到太慢了
0,"味道还行,就是这肉切得太厚啦,太肥啦,第一次吃到这么大得肉"
0,"慢慢慢,。都想退了。做的倒是还不错"
0,"还行,就是一个多小时才送达"
0,跟一般的卤肉饭差别还蛮大的～一般
0,十一点多订的，等了半个小时打电话那边才确认订单，葱香牛肉焗饭偏咸
0,好吃是好吃！10点定的11点半送餐！最后都13点了才吃上！真是够了！可是挺好吃的！量还算不错！
0,快递哥雨天送外卖很辛苦。麻辣烫一般，
0,"辣牛肉汤没有米饭,希望以后能注明,一般韩式料理都是买汤送米饭的"
0,3个小时没送到，打了2次电话说会联系我就没结果了
1,真实在。菜有点少。肉很多
1,"百度骑士,非常好,！"
0,"11:46下的单，首次送达就是13:34，而且酱香排骨豆花米线仅有菜没有米线。,再次送达米线时已经14:10。,等个饭等了2个多小时。"
0,一个小时才到，粥也洒了，饼也凉了
1,很好吃，送餐及时！
0,居然里面还有油炸蟑螂！！！请问怎么投诉！！是打消费者热线吗！！！
0,送餐慢'菜和粥都咸
0,一般吧，有点偏咸口
1,"很喜欢吃,卷瓶很实惠"
1,这次送餐时间超快！
0,排骨也就六七块，牛肉羹看不见牛肉，搞活动可以吃吃，因为便宜，不搞活动还是算了吧！还不如吃个盖饭
0,饭挺软和的，三份饭，两份菜没放盐是的
0,20的套餐，4个菜，还行吧。
0,实在是一般啦
1,蔬菜的特别辣，土豆丝的里面也有辣椒。总体不错。不能吃辣的一定要记得备注
0,"本单实际送达时长为39分钟,瞎扯我等了1小时30分钟呢"
1,百度小哥速度超快提前半小时到，非常感谢，这么冷的天真是不容易，再次感谢
1,很好吃，。送餐准时！！！
0,服务态度极差！
0,点的卤肉饭和牛肉丸，都很好吃，可是没有勺子，我让开发票了，也没有给开发票，而且我是17:15下单，17:16商家确认订单，直到19:02还未送到，我电话查询后，告知说漏单了，我只是实话实说一下，没别的意思，在中关村这家吉吉熊订餐十多次了，这次是等最久的一次，但是可以被原谅，谁都有失误的时候。希望店家以后注意下，我以后还是会在你家订餐的，因为饭很好吃。
0,榨菜太多了。红烧肉里有榨菜，还附赠塑料袋榨菜，太咸了。
0,"搞活动买的,9块钱都觉得不值,就一个蛋几块豆腐加上一点点的泡菜汤的调味料,。。。。。"
1,"不知道为啥连袋子都没有，端的我一手油，牛肉的味道可以就是师傅的刀功能再好点么,大的太大小的太小。白菜太油了,建议青菜少放点油，有汤都可以"
0,金手勺你家血肠我特别喜欢吃，可是你居然没有单份的了，我恨你
