label,review
0,滑鸡饭不新鲜而且盐放太多齁死了。小笼包一点都不好吃，而且太凉，醋包也没有。
0,什么玩意，一个多小时没送到！再也不我用了
1,肘子味不是很浓，但卷饼不油腻，口感很好。
1,喜欢宇宙卷饼，送餐也很快，很划算
0,菜里全是汤洒了一袋子。。
1,很喜欢酸辣汤～好喝～其他菜有机会尝试
0,速递级慢，等了将近2个小时，也没有赔付，以后没法在百度订了
1,挺好得。买完了皮蛋瘦肉粥还给我打电话问问要不要南瓜粥。赞
0,定的饭，餐具全是叉子。也没有纸巾。越来越失望。
1,很不错，送餐速度加快了
0,不喜欢，有股怪味。。扔啦
1,非常热情的大哥，速度快服务好
0,简直了！！特别慢！！一个半小时才到！
0,第一，送来时候已经凉了。第二，青椒鸡丁完全没熟啊。炒时间太短了。
1,小哥很棒，态度很好，才还热着，很好!
1,超级好吃，特别喜欢肘子卷饼～量的话一个够女生吃，男人不够～
0,太糟糕了，大份的薯条只装了包装的不到一半。汉堡都像是儿童餐！
0,很好吃，送餐小哥也很敬业，配菜能再细心点吗？
0,米饭和粉条都很硬
0,和这个价位差的太多了
1,送餐准时，服务到位，非常好。
1,比想象的高大上好多啊…很好吃。
1,好喝，也没有漏。，，，，
1,"好实在的卷饼,够值"
1,速度快，又好吃。
0,等了近两个小时
0,"难吃,而且很慢"
0,饭是冷的辣白菜汤撒的到处都是。发票已经污损。
0,疙瘩汤比学校食堂都差，没这么糊弄的！扁豆面，基本都扔了
0,外卖的正一味跟店里的饭菜简直不是同一家的东西
0,备注了不要辣不要辣，结果还是一堆辣椒，胃疼不能吃辣，一整个扔了，里面还有一堆洋葱青椒，肉一点点！差！
0,菜品不错！送餐大叔好凶啊！
1,泡菜特别棒，大赞！
0,最差的一次点餐！七点钟点的餐，九点才送到。煎饼都塌了，红油抄手简直就是红油速冻水饺！再不点黄太吉了
0,"吃到一半发现菜里有小强,简直了"
0,"土豆不是新鲜的,牛肉质量差"
1,送货速度很快
0,梅菜一般，肉还行。配菜凉拌黄瓜还行～
1,感觉非常棒，虽然有一点凉了，不过味道很棒！
0,"速度慢,卷饼凉,太难吃"
1,送餐巨快！态度超级好！面条好吃！就是花生米菠菜，花生太多了！本来想吃点菜的！
0,没有另一家的好吃，送的太慢了
0,很难吃。还不如肉夹馍
0,吃完到现在反胃，全部吐出来了
1,送餐可能没有看我标记的送餐时间，提前送来了，飘香肘子的很好吃
1,食物很干净，吃着放心
1,"奶茶虽然有点洒,但送餐小哥速度很快,面也不错,给个好评吧"
0,牛肉套餐还可以，就是送餐超级慢啊
1,喜欢吃皇太吉的煎饼
1,送餐非常的快，价钱给力
1,超喜欢吃豆腐脑和煎饼
1,好的还可以
0,"写着猪蹄/个……到手的只有半个～,感觉受到了欺骗……不是一个可以写份啊……"
1,肯能距离有些远，配送的比较慢
1,热乎乎的，谢谢，送餐员辛苦了，速度很快，谢谢
1,一直点他家的煎饼，第一次点卷类，卧槽，辣成狗了，希望商家少放点辣椒，实在受不了
0,"超级慢,等待了107分钟,我吃着都会胃疼,饿过头了..,送餐员电话也不对"
0,最难吃的一家
1,量大，味道也不错，性价比超高。
0,我想给零个星，可以没有呀！！！！！太慢了，2个小时了！！打了好几个电话催，每次都是再等10分钟，不如自己出去吃哇，这么慢，等什么外卖！！我自己去店里都能打四五个来回了好嘛！！我十一点多就定了，还要多早呀！！等到现在已经一点半了！！幸好没有急事！！！已经没有心情了！
1,还不错~~包装袋子特别棒！还送的有一次性拼图~
1,好喝，百度送的很快，非常感谢
0,菜品质一般千叶豆腐就小米椒有个味扣肉味太淡肉片厚
0,口味一般，送的太慢
1,非常快～辛苦了～很好喝
1,送餐快，菜品还是热的.服务也好
0,送来都凉溫了！！！
1,超级香，就是送到的时候稍稍有点凉了
1,很好吃~~！！
1,一般，煎饼更适合现做现吃吧
1,不错好吃，就是最后有点油
1,又快又好，量足，经常吃
0,卤打的还行，囊质量差了点儿，配送比计划晚了一个多小时，严重不满意。
0,好辣，豇豆是煮的，这个菜顶多算个盖饭，太贵还不值，再也不会买了，菜太少，加了好多水
1,包装好，味道好，很满意。
0,感觉菜的分量少，没吃饱
0,没收到餐~~11:45分送，13:20还没送来，退了
1,少送了一份南瓜羹，不过后来很快补送了，超爱
1,送餐员速度快，态度好
1,等了有点久
0,速度确实不是一般的慢，菜品我很喜欢～赞一个吧
1,好吃.很棒！！！！！.服务态度也好
0,我的煎蛋呢，少了煎蛋，是不是应该退我煎蛋钱！！
1,没想到稻香村也能送！非常好
1,好多肉啊，又便宜，很不错哦
1,非常满意，送餐员态度很好
0,这麻酱做的是巨恶心
0,等了70分钟
0,真是慢啊快两个小时了。。
0,有股怪味，吃着没食欲
0,我的两个中奖瓶盖拿走后就没有下文了，4元可乐居然是灌装的！！！！
1,"送餐超快,面不坨,味道好"
1,"配送速度很快,每个品种分开装纸袋而且包的很好,喜欢吃"
1,凉面送来的时候有些软～但还是很好吃
0,送餐慢，超级超级难吃，一点味道都没有
0,太慢了！青椒太多！
1,送餐的大叔非常好
1,蛮好蛮好！
1,"哎，过了12点订送的就很慢了。。。差点把我饿死。。。不过看在送饭的是个妹子的份上还是好评吧-,-。。。"
0,"不,好,吃,！"
0,晚了三个小时！！！不管什么原因！！
0,"一直都点你家饺子,觉得味道很好，但是今天居然给我送错馅儿,我要吃茴香鸡蛋茴香鸡蛋，我点了两份茴香鸡蛋，你给我送两份素什锦干嘛！！！"
0,星星是给百度外卖和配送员的，配送员在路上遇到问题耽误了配送时间，百度外卖给打了五折！配送员的态度非常好，赞！食物就不推荐了，不新鲜拉肚子两天了……
0,垃圾，真的很垃圾，订的饭吃了以后拉肚子，真心恶心，垃圾。再也不会订他们家的餐了。垃圾。劝大家小心点。
0,有机菜花里有虫子
1,好吃就是太少
0,时间太长，休息日居然90分钟，味道一般
1,百度的外送送了小礼品！很高兴！意外惊喜！
1,送餐太慢，饼也不好吃，里边都是肥肉
0,最差餐厅，没有之一
0,鸡蛋都坏了，凉菜也洒了
0,食品味一样，但是打开餐盒后发现竟然裂了一个到底部的口子，如果直接在那家店买给餐盒也不会裂口的，不知道是不是故意拿了一个裂口的装的
0,中午12点下单，中午2点给打电话说抱歉了！马上就给您配送！我说那好吧，又过了一个小时、给打电话说正在制作中！我说我不要了！退餐吧！等不起了，在等我要饿死了！结果不给退款，愣等把晚饭送来了；还他妈的是凉的
1,不错，菜品选择再多一些就好了
1,前几天点的卤肉饭要是单卖里面的泡菜就更好了
1,送货快～一直听说黄太吉～终于品尝了～很好吃
0,菜老了，鹌鹑蛋是臭的，重点是：我的烧饼呢？！
0,差评！没见过比这更慢得外卖，差评！而且还难吃。！
0,这大牛逼鸭子做的~能再老点吗~面酱能在混事点么~鸭子没味面酱走味还开个什么啊~早日关门大吉吧~
0,真慢，批萨凉了真难吃
1,百度骑士很棒，又快又好
1,总体不错，不过备注有让加辣，结果没有加…
0,"肉太少,全是土豆"
0,外卖员不进园区
0,老坛酸菜牛肉面不是特别好吃，面不筋道，比较油腻。
0,说了三遍加奶油，还是忘了，好难喝
0,老北京鸡肉卷不新鲜，吃着凉的怎么越来越不好吃了，还有奧尔良烤翅炸得太嫩了，好像有水分不像炸，吃起来像生的，沒有以前的好。不会这订了
0,真心有点慢！
0,"我马上就要饿死了,跟我说马上就到,马上就到,这马是没吃草吗,下次别放那咸菜了,味道难闻的要死"
0,"写明是两个盖饭，结果是一盒拼饭。,面冰凉，还得重新加热"
0,"无语了啊,鱼香肉丝卷饼没有单点选项,无奈选了套餐,凑不到起送费又点了粥,于是注明了套餐送的饮品不要粥,现在好了,两个粥,真是浪费。。。还有外卖小哥的态度,啧啧。。。"
1,粥不好喝！饼不错！加油
1,"包装很棒,可惜味道偏甜不合口味"
0,奇怪的柚子茶和甜甜的煎饼，可能是没选到适合的
0,将近一个小时才送到，因为已经要离开原送货地点了，要打电话问店家电话也永远不接，反正吃到的时候已经都塌塌了，所以口味没有传说中那么好。可以理解太忙了所以很晚才送货出来。但是明显不是占线而是客服故意不接。这样有急事需要联系的话真的太不好了。
0,十一点半定的，说十二点半到，我知道我定晚了～我没催你们吧，理解你们吧，结果两点多才到，我吃的是午饭么？！能不能干？不能干别接单！
0,慢，饭还可以
0,商家没有给赠送的饮料
0,太差劲了吧，同一个店，外卖包装居然相差那么多，昨天的饮料是罐装，今天是纸杯，昨天的餐盒是双层保温的，今天就单层，最过分的是，我点的芝士泡菜炒饭，结果只是泡菜炒饭，没看到一点芝士，味道也没有芝士味道，希望给我个能说得过去的理由。
1,味道有待加强
1,"好吃,速度快！"
0,为什么烤肠付钱了，怎么没送啊
0,等了2个小时才送来，快递小哥倒是一个劲道歉，然并卵
1,第一次买冰沙，口感真不错！喜欢
0,辣么大的盒子，米饭一点点。好坑人
1,"第一次定,挺好吃的,就是有点慢,可能距离有些远"
0,送餐速度比较快，但是少送了一份，只能让外卖小哥给退了，可是还是有一个人没吃上饭，有点坑～希望商家下次配餐时候认真一点
1,味道好，送餐快，分量足
0,"太难吃了,海藻巨腥"
0,没有在店里吃好吃，萝卜太多了
0,馄饨还可以
0,"沙拉没给酱,没给叉子"
1,"点了三次了,很好喝,送的也很快"
0,菜有点少，米饭太多了。
0,送餐，我等了两个多小时，饿死俺了
0,"给我送的饮料洒了,很多,袋子也湿了很多"
0,晚了足足有20多分钟…不催也没电话
0,"备注都说了不吃猪肉，包菜卷粉丝里面有肉末为什么不说呢？浪费了,根本吃不了"
0,"京酱肉丝,居然没有葱丝，真恶心！！！！！！！！,恶心！！！！！"
1,岩盐芝士的也好喝
1,酸汤的牛肉面对我来说不够酸，总体都还不错
0,慢到差一分钟就半价了，全凉了
1,挺辣的，吃着还可以吧
0,我点的20元的牛肉蔬菜卷，送来的是8元的尖椒土豆丝
1,挺好的也挺快，味道不错！送餐小伙态度极好！
0,超过了预期时间
0,送货慢，订的排骨没了，换了个黄焖鸡，有点辣
1,大份确实挺大的，吃不完
0,越来越不好吃了
1,特别感谢快递师傅！这么大风天气还准时送到！辛苦辛苦…谢谢啦！
0,送餐时间挺快的。味道实在难以下咽。吃了两口就扔了。
0,"速度很快,质量很好"
1,"很好吃,送餐的很冷"
1,快递员态度好，送餐快，总之都很好。
0,锡铂纸包的，感觉里面面皮没怎么熟，不是多好吃~
0,"不明白为啥送餐如此慢10点订的12点40才送来，催餐还要我自己催，我要不是找到送餐人的电话，送餐人说还先送别人的，那你就不用送了，我直接退单好了，都到下午上班了，还吃啥！最后一次，如果再送晚，真心再也不订了！,不过说句实在话，饭还是不错的，稍微有点凉了，能看出是早就做出来但是送餐人太墨迹的缘故，不过餐厅你也应该主动催啊！电话打不进去，打了20遍通了居然跟我说让我自己催，你们忙~我就呵呵了！"
1,味道不错，送来的比较慢
0,下单确认后一刻钟才被告知没法做，我也没辙了…
0,是我吃过的最难吃的鸡肉
0,快递员挺好，速度挺快
1,不错，不错，用了券比自己去店里买便宜。
0,没有肉，只有咖喱，汁也很少
0,"你饿死爹了,这种服务水平等着关门吧"
0,时间太慢了
0,太难吃，石锅拌饭没有拌饭酱，外卖也等了好久
0,"炒饭很美味，香辣拉面味道比较一般,面条有些软"
0,送达个屁啊！我这还没吃上呢，系统就显示已送达！！！我只能说这个软件是神马玩意啊！！！！
0,量不大，吃不饱。。
1,评价晚了，袋子好高大上，东西也好吃，快递员态度也好，五星好评
1,快递小哥服务好，速度快
1,满意，很好，配送给力食物好吃
0,就还行，没有很好吃
0,鸭子太腻，没法吃。
1,整体都很不错
0,2个多小时没送货，中间催单多次无果，最后打电话让店里取消订单。一个没注意，订单完成了？！还扣款了，什么情况？！
0,说好的发票呢
0,味道好，送的也不慢，就是包装不严实，一个纸袋子也不封口
1,"皮蛋瘦肉粥,我一看还以为是白粥。。。"
0,咖啡撒了些出来
0,"送餐特别慢,没给我发票"
0,饭菜都凉的，一个多小时才送来
1,"味道很好,只是最近双拼换了餐盒,参合不大好,送餐及时,送餐小哥认真负责,态度很好"
0,猪耳朵又碎又咸，不建议点
1,超级好吃哦
1,"不错,很好吃。。。"
0,冷面难吃死了，还不如方便面，太垃圾了，
1,米饭一般，4块有点贵，小炒肉不错
0,订餐时间是中午1点，等了一个多小时才送到，打开一看量少的惊人，炸薯条成了粉条，软绵绵的，拌饭里的蔬菜跟剩了几天的菜一样，黑乎乎的，炸鸡更难吃，价格一点不便宜，还做的这么难吃，第一次定也是最后一次！这里不能放图片很可惜！
0,说好的加一份油麦菜呢？
1,"如果是肉片就更好,饼如果能更筋道一些，就太完美了。"
0,宇宙级蜗牛送餐速度，共花2.5小时，并且还没到。
0,并不是太好吃
0,一个半小时
0,点的肘子卷送的土豆卷，打电话说再送过来也没送。
1,卷饼味道不错，粥口感好，分量足
0,不好以后不回来了
0,送的太慢，煎饼都凉了
0,慢的要死，等了一个半小时才到
0,东西要什么没什么，
0,饺子皮太厚饺子包的有点像包子
0,好慢，差一点就超时能打五折了
0,"什么送餐速度，你么13：32订餐，14：36还没送来，打电话问人家答复还让再等半个小时送来，这你么也太霸王了吧，虽然就点一份也不能用这种服务态度对待，就算是免费得外送,人家都是第一时间响应，服务态度实在不敢恭维！！！"
0,菜都是凉的，一股腥味，再也不会订了
0,又自己换菜也不通知消费者！能提前和消费者说一下吗！
1,天这么冷还能准时送到，非常感谢，一百个赞
1,快递小哥太给力了，从下单到送到只用了半个小时，牛肉面都没有坨，只是豆干收了1元的打包盒的钱却只是用塑料袋装的，好在百度在线支付活动给力，省了好多钱，也无所谓了
0,"汉堡王给错货，但快递员人超赞,给联系补货,很晚也送过来"
0,"口味很不错,但是卤蛋真的很坑,建议别点"
0,哇塞，太难吃了！！出乎意料的难吃，路边煎饼都比这好吃，还有鸭卷，肉都没入味，真的是服了！！差差差
0,"严重超时,咖啡都洒了"
0,冷面兜黏糊了
0,好难吃啊，意大利面粗，肉酱有奇怪的味，披萨饼怎么是酸的
0,备注了11：30送到，又提前半个多小时就送来了
1,很好吃，特别是很准时，量足味美，还会再买
1,好吃，豆腐脑也很好，就是送过来的时候有点凉了，得加热一下
0,"东西弄得太脏了,还难吃"
0,忘了放辣椒了，味道一般，南瓜饼还不错
0,"太差,一点都不好吃,送餐特别慢"
1,准时到达，太给力了！
0,刚刚订完，打电话取消，都没取消成功，还是给送了，搞得课都没听好，订餐需谨慎，订了就不能取消
0,小炒肉还可以，担担面太失败了，又油又辣面也化了，果仁菠菜的花生好吃，菠菜都不新鲜了，不知道是不是被醋泡的。速度一般吧。
0,还不错，送餐师傅很给力！
0,除了时间慢没别的不好
0,有点腻。没给拿勺子。
1,送来的时间还是能接受的，菜品也都保存的很好
0,"不好吃,很不好吃"
0,人多有点慢，有点受不了，一等就是两个半小时。
1,"东西好吃又实惠,送餐又快,好评"
0,员工素质差，不虚心接受评价，认真改正，还给客户半夜三更打电话骚扰，还记录了认真给他们做出评价的客户，还打电话说一些不侮辱性的语言，还给客户发送黄色图片侮辱客户，太差了。没见过比这个餐厅素质更差的餐厅。有这样的员工迟早会关门大吉。
0,弄错地址了还让我取消订单，我还饿着呢。能走点心吗
0,第一次用百度送擦的！太失望了！足足等了1个半小时！！！
0,送餐很慢很慢，定的很早了还送了一个半小时。定的粥没给送，说给退钱也没给退，一点诚信都没有，同时也遇到过同样状况，不会再来了
1,好咸的酱香鸡腿啊！
0,筷子少给两双，还得我们在展会满处找不到筷子。跑出去好远才找到，差评差评
0,很生气！我在备注上写着不要香菜！结果里面一大坨！套餐里的青菜一大坨香菜！气死我了！还让不让吃！
0,服务很好，希望下次还是他
1,速度挺快，东西很不错
0,送的倒是挺快的，只是汉堡做那么小好意思吗？
0,外卖员很差外卖员很差外卖员很差
0,"6月16晚五点半,下单手机18810547705。根本就没给送，我就想知道你们给不给个解释。外卖被你们吃了？"
0,什么都没收到，就显示完成了。
1,服务非常好，菜品也好吃！
1,感谢送餐小哥，态度非常好
1,"相当好,包装精细,味道好,送餐速度"
1,真心好吃！！
0,还是那个味！
0,菜不错，只是送餐服务不好，时间总是不准，公司离订餐的地方300米，送餐时间误差45分钟左右，我订12点送，有时11点10送来，有时12点45送过来，你提前送来面都坨了，怎么吃，什么玩意。
0,"太差了！配送员把饭都撒包装袋里了,还好意思收配送费,无语了"
0,送餐的只送到楼下，不送上楼，下次不订了。
0,垃圾，我们在住院，居然不给带餐具
1,果真是大馅饺子，味道很棒啊！
1,"量很足,确实够厚,大号的吃不完"
1,没送王老吉
0,店家老板请交待店员不同馅的饺子不要混装一个盒子，我很反感这种做法。
0,味道还不错，送来的时候没仔细看，结果发现我多加的一份米饭没有给我，餐具也少给了，也许店家太忙，希望能够在细心一些
1,快递员很辛苦！给个
1,很好吃，送餐速度也很快。
1,感觉味道没有去实体店好吃
0,"服务垃圾,非常不到位"
1,可能是第一次来，送的比较慢，还好。
1,不错，料很足…………
0,面也太少了，才半盒，我就没吃饱
1,好吃非常好吃非常高兴
1,送餐很快，人也跟nice，好评！
1,这次送餐超快，好评，好评，好评
1,很好吃，很卫生，很满意！！！！！！！
0,"送餐时间太慢，完了近一个小时!,以后不订了！"
0,未按照约定时间送达
0,面竟然一点辣椒都没有，那还叫面吗，，，，晕死了
0,不好吃，可能我比较挑
0,吃完一会就肚子疼，过一会就拉稀了，不想再说了，你明白吗
1,"听闻不错,亲自品尝,面的味道确实可以"
0,非常不满意，量少
0,"1.百度外卖快递小哥是OK的！,2.麻辣烫是大大缩水的，点了一份鹌鹑蛋，3元只有一个！只有一个！只有一个！重要的话说三遍，我擦，三元一个鹌鹑蛋！,3.强烈推荐别点这家的外卖了！！！"
1,喜欢这个味
0,"一般,不好吃"
1,沙拉忘了酱
0,下午5点15才送到，电话说因为上个客户所以耽误了我的，蛋糕已经全软了，等了一天，郁闷！
0,味道一般！而且等了一个多小时。
0,送餐很快的，味道也好，就是麻辣香锅里花椒多到和菜纠结的抖不下来，真没法吃。米饭很大一盒。
0,挺不喜欢给一般的评价的。腊八，特意提早到十点半订的餐，结果还是晚了近一个小时。肉饼和糊塌子都凉了，而且特别的油，菠菜老的嚼不动，黄叶子都在里面。也不知道说什么好了。
0,"不好吃,太腻了,饼还很厚,皮蛋粥就是白粥,等了一个多小时"
0,根本就没有送黄飞红花生啊，坑人的吧，广告打的那么大
0,送餐服务有待提高！！！味道不用说！晚了半小时！
0,菜都凉的，感觉没熟，量太少！
0,晚上七点订的外卖，九点还没送到，电话说是忘了我的订单，说好的退款一直没有退还
0,"恶心，说好的11点15送达，晚了1个多小时，分量那么少，,根本不是牛肉，卷饼汤露的到处都是，饼都没熟，不知道什么味，真难吃，服务挺好的，有毛用，草，再也不在你家买了"
0,"40块钱的面,就一块肉,还有啥可说的"
0,"拌饭不怎么好吃,可能我吃不惯吧,鸡块还挺好吃的"
1,好速度啊！宇宙卷饼棒棒的！谢谢骑士
1,就是没菜，都是肉有点儿腻
0,菜量太少了，不够配米饭的
0,不怎么好吃
0,还行…味道不咋地
1,"味道很好,骑士辛苦了,谢谢"
0,极差评，百度你们的配送员太垃圾了。
0,单加的鸡肉，藕丁，鸡枞菌都没吃到
1,煎饼挺好的，就是龙抄手真心太少了，而且一碗要大十几块钱，有点不值。
0,太腻了，口感不如西少爷
0,完全忽视送餐预约时间。发票没有，餐具齐全，味道保证，就是送太早到中午时间已经凉了。
0,饺子太难吃了，再也不定了。
1,师傅速度快，服务态度好，菜好吃！
0,送餐时间太长快一小时了
0,菜过于油腻，而是前几天直接去店里，对服务很失望！
0,呵呵﹉一颗星都不想给你
1,挺实惠的，吃撑了
0,堂食与外卖的菜量难道不一样吗？菜量明显不够啊。
0,服务态度太差了，找不到地方还骂人，挂我电话。建议换一个靠谱点的小哥
0,送来的太慢了
0,"送错单了！！！！态度特别横！！！特别差！！！！我特意确认收货,给差评！！！态度太恶劣了！！！说一会儿再给送,问还得等多长时间,他说那不知道,我们说那就不要了,他还说送都送来了,意思是必须要,态度特别特别差,就跟我们做错事一样,没见过这么牛逼的送餐的！！！以后再也不会定了！！！"
0,这家店的冰淇淋蛋糕不全是冰淇淋，有至几乎快一半是蛋糕和奶油。
0,我家离贵店不是很远，送餐大概一小时，菜的口感一般，价格偏贵，米饭很少，性价比一般
0,没有赠送，250ml统一多彩饮料（软装）1份
1,好吃极了，这次送的还比较快。
1,送餐师傅态度很好，送餐也很快，谢谢师傅的服务。
0,一般，排骨给的少
0,榴莲只有一点，推荐烘焙工坊
1,"饺子太好吃,妈妈的味道"
0,味道一般不太喜欢。
0,等了140分钟才到…卷饼也不知是凉了还是别的原因，味道很差
1,"就是洒了,其他还行。。。。。。"
0,两小时没送来，退订电话没人接，最后没拿到饭也没退成钱，就当钱掉河里了吧。
1,儿子最喜欢吃站点，昨天因为脚崴了不方便出门，只能外卖，其他都很赞，但披萨我觉得像提前做好翻热的，因为已经很硬，我们一直在亚运村店吃，一个披萨的烤制时间不短，昨天从下单到送来，时间不太对。
0,坦白说，饭菜挺好吃的。但是送餐太慢了，快2个小时才送到，送餐员也不容易。希望能多些送餐员配送。因为送餐时间太长非常影响用户体验！
0,十二点订餐，两点送到
1,粥还不错，饼还没尝，包装挺好，看着不错
1,配送时间真让人无语了，不过大热天的送餐的老人家也很不容易，相互理解吧，下次别让我等三个小时就好
0,"可能是由于中午点餐人多,等了1小时20分钟（11:38下单,外卖12:57才到）才送到,送到时,汉堡全部都凉了,已经用百度外卖好几次了,这次最心塞"
1,卷饼应该比拌饭好吃，拌饭里的菜放的酱太多
0,菠菜没洗干净…
1,鸡肉卷肉很多呀，味道不错
0,锅包肉裹得糊太多了。烧茄子味道也不好，菜味一般。下次不会再定了
1,地道的碱面牛肉面，好想念的家乡的味道
0,在莫名其妙地取消了一次我的订单之后。我又带着我在东直门银座堂食的那次美好记忆里定了一次。步行10分钟的店面让我等了一个小时之后，换来的是完全冷掉硬地咬不动吞咽拉嗓子的煎饼。可送来的豆浆还是热的。也许煎饼在后厨呆了一个世纪才送到了我这吧。。。。。。。黄太吉，真的来得及吗。。。。。
0,第二次了，没有番茄酱。送错餐也是多次！
0,送的面食，就提前确认好位置嘛，送了一个小时，要客户一遍遍催，面放一个小时基本就不能吃了。服务态度还行，但经验还得加强
