label,review
0,淡而无味，没有虾的香味
0,秘制凉皮很难吃，很失望，混沌也不建议点，味道不怎么样
1,"啊吃完一股香菇味久久萦绕无法散去,南瓜粥不甜"
1,不错，外卖小哥挺好玩的，东西不错，我觉得肘子的好吃！就是粥吧，有一根很短的头发。
0,食物很好吃配送很烂很烂，足足等了快两个小时，说什么电脑坏了没看到单子，那请问怎么接单的呢？忘了就是忘了还找借口，烂上加烂
0,俩小时才送到。两份粥才给1个勺。逗我呢
1,味道不错，下次再订。
0,大排性价比不高
0,肉有一股刷锅水的味道，希望下次注意
0,骑士送餐很快，饭菜太难吃
0,一多半是空壳！怀疑把吃剩下的给我了
0,坑爹，一点不好吃，想被坑的就来点吧，这种店只会坑我一次，菜一点油都没，这种店注定不会长久。。
1,很好吃，也很快，非常不错，要是酱香鸡腿卷中的蔬菜可以多点就更好了！
1,简直太好吃，不过我弄了一裤子油TAT皮蛋瘦肉粥棒棒哒！
0,"还可以吧,味道可以再辣点"
1,"好吃,就是每次粥送来都有点凉"
1,整体口味偏淡
1,好方便，用了代金券比去店里买还划算
0,肘子就是几块猪肉，光有情怀有啥用~
0,不好吃，没味道，没有餐盒拿个袋子装给我，还要餐盒费，哎...
1,味道很不错，快递也给力
1,很棒的哦，第二次订餐了
1,煎饼还是得现做现吃，豆腐脑非常好吃！
1,配送超级到位，配送员认真负责
0,超级难吃，最差的外卖
0,今天送的很差…铁板煎鸡碎散，分量不足，并且菜特别少…
0,辛苦送餐小哥了！菜量太小了~100多块钱都没有吃饱，鸭血小的都找不到，总之不值~
0,很差，时间太短了，不好吃，
0,我擦，怎么会有好评的，炒菜还没有食堂一勺的量，抢钱么
1,价格实惠，很好，值得购买。
0,没勺没筷子怎么吃
0,"送餐速度还可以，就是没有番茄酱！！！！！！！！,没有甜辣酱！！！！,没有餐巾纸！！！！！卖家能不能上点心，真是不负责任，差评！！！！！！"
1,味道很好又订的挺好吃
1,还好吧。饼的口味差点儿
0,口味还行吧。。。就是送餐太慢太慢太慢了。。2个小时啊。。
0,"1.送货奇慢，已经慢近了45min,2.我点的套餐，结果比单点就多一个可乐，但是多了8块钱，就是罐可乐8块钱，坑！！！,3.味道都凉了，真的不好吃！！！,总之烂！！！！！"
1,"很好吃,包装也很高大上,惊喜"
0,给的豆皮果然多，只是肉变少了
0,牛肉都碎了，比较咸。
0,慢啊慢！！！十点10定的餐，十二点半不催还不来！服务态度不错就是慢！不饿的就可以慢慢等！蔬菜卷蔬菜太少，全是洋葱！！！包装还行…可有啥用呢？华而不实！
1,快递师傅很好，饭也不错，味道不错，尤其量也足，那米饭给的，都吃不了，太少见了
0,竟然需要90分钟才到！
0,试过了大大小小的品种，煎饼品质比较统一，基本都好吃。凉面真的不好吃，抄手的汤太咸，因为外卖路上耽搁，整盒抄手已经全被酱汁泡成深色，非常咸。这两样品质配合15和18的价格让人感觉贵的不值得，严重不推荐。外卖路上会有颠簸可能会流出汤汁，但这次点的有点夸张，抄手的红油酱汁流得袋子里全是，纸巾全湿透，勺子和湿纸巾外包装上也都挂了辣油。如果有客人在外面用餐周围没有东西擦拭，一定会很影响用餐。建议配送环节再优化。
0,送餐很快，菜像剩的，食材感觉用的都是边角料。
0,我定的是酸萝卜鸡胗饭，请问老板，我的酸萝卜在哪里，一块都没有看到，米饭特别干
1,非常好吃也很快
0,"十一点订的餐送五十分钟，领了餐之后五分钟不到的路走了二十分钟……真是拉慢骑士水平，不好意思不能给好评了。,第一次订，也是最后一次。本来想吃煎饺的，这煎得是个什么玩意，油都舍不得放，就在锅里面过了一遍就拿出来了。这样的一餐花了三十多，我也是脑子发热。"
0,身为东北人真是第一次吃到这么难吃的东北菜啊！得莫利炖鱼里的白菜有一股羊肉膻味，不知道是咋回事，挨着鱼头的地方还带着血，恶心死了，而且鱼头去掉鱼鳃的地方是黑的。压锅排骨油豆角还可以，但是排骨是真心就吃到一块，偶尔有几块大梁骨，味道倒是还可以，中规中矩的。
0,"百度外卖应该叫蜗牛外卖！太慢了！送过来是凉皮里汤水都已经侧漏光啦！南瓜饼压大一圈！,就酱紫。"
1,同在五道口就是送得快，不过好像去年买的时候这个价钱可以买套餐了，虽然就差一碗粥
0,饮料都洒了，把汉堡袋子都打湿了，外卖员还让我看有没有问题，薯条撒了一地，本来要申诉，要不是看在外卖员是一个年龄挺大的大叔，就算了。百度外卖对外卖员是不是该统一培训一下？
0,菜量非常少，是给小孩准备的吗？？
1,尖椒土豆丝不好吃，别的都不错
1,"外卖大哥超级好,披萨也不错"
0,订的11:45的餐，结果11:30就到了。最主要是两份饺子没有料，连筷子也没有，建议店主改进下。另外，扁豆丝盖饭味道有点甜，不太好吃
1,"好吃,满意"
0,菜很好吃，就是真的送了2个小时，还想着错过高峰期10点多一点就点了餐，结果……
0,饭好难吃啊
0,没见过这么慢的。十点下单，11点半才开始送餐。12点送到已经冷了。简直是花钱买罪受。
0,送到之后面基本不能吃了
0,味道可以，但是配送服务不好，取消订单了也没有电话通知，等了很久
1,很快很好。谢谢。辛苦了。
0,3次了，就不给餐具的？！
0,汤撒了，不知是一开始就没盖好还是后来晃的，另外没有餐具，这个肯定是一开始就没放
0,太鸡巴坑人了，四角小饼够鸡吧谁吃，备注还写了饼稍微多点，草，赶紧倒闭吧
0,"我说的不要辣，意思就是如果要加辣椒你就换成别的青菜，真是妈的辣死我了,，我有肠胃炎，不能吃辣，而且吃辣椒咳嗽。"
0,盖饭洒了，面也洒了成一坨不能吃了，最失败的一次订餐
0,确定这就是炒乌冬面么？疯了
1,送餐真的不快，鱼香肉丝的不错～
0,少收一家钱就直说.还尼玛说都没给钱.放下东西就走了.你当人都是傻逼呢是么.现在百度外卖真心不能用了.要么给假钱.现在又想多收钱.你是没见过钱么.
0,9点58分订的餐12点15才送来！头一次碰到这么差的服务！不要了！
0,卷饼一直不错，可是那粥实在是太差了。比稀饭还不如，以后还是不要卖粥了吧，拉低了菜品质量。
0,送的速度挺快的，态度也不错。菜的质量还可以吧，蔬菜不是特别多，但是用了券价钱很合适。
0,送的倒是真速度～可是勺也没给餐巾纸也没有-_-#…以后不点这家了…面不好吃～一股子很不新鲜的味道…鸡腿也是闻起来不新鲜…酒糟小汤圆好马马虎虎…
0,难吃，用照片欺骗人，天气这么好，不按时间送。
0,下单一个小时！！！还没有人接单！！！！！！！！而且取消订单非得要打电话！！！！什么傻逼规矩！！！！！！！！！！！！！！
0,洒的很厉害，然后两杯咖啡不给杯示，根本分不清啊，卡布的奶泡本来应该很多，都洒了，跟拿铁一样了，囧
1,不油腻，好吃。陪米饭
1,"飞速,南瓜粥没了换了皮蛋瘦肉也ok吧"
1,挺好，就是薯蓉太干了
0,我都疯了。这一碗辣椒怎么吃。。。
0,关于送餐，速度我已经无力吐槽了！！！一个半小时，一个半小时，一个半小时……
0,真的很慢，等了一个半小时，饭都凉了，味道还可以。
0,"太难吃了,.."
0,牛肉由肉片变成了肉块，很不好嚼。
0,忘装海带丝，投诉！
0,"我能说我没有吃过这么。。。。算了一人一口味,等了一个多小时真的太失望了。第一次吃也是最后一次了。。。"
0,脆皮蛋卷没放！！！
0,第一次定好吃，挺干净的
0,送餐太慢了。。10点多订的，现在还没送到。。。。
0,"买了这几次的面都不好吃。都糊掉了的,猪手挺好吃的"
0,两个小时送到，够够的了！！！再也不会点这家了！！
0,配送的人态度太差！投诉！
1,很快，不过
0,"汤的味道还行,就是送餐小哥第一次来这边,用了很长时间"
1,估计是太远，不过味道倒是令人惊喜啊
1,粥有些腥，饼有点腻
0,真的佩服的五体投地什么人吧
0,送来的咖啡封口开着，洒了好多
0,铁板烧汁茄子味道真心不错！宫保鸡丁做的太甜了。水煮肉片味道还凑合，但是肉质太干！
1,回锅肉分量很足！很不错！
0,订两份送一份，第二份等了四十分钟也没送
1,"很准时,服务好,就是这份南瓜粥,有点奇怪的味道"
0,商家服务差超差，要的细米线送来的是粗的，要求退换，给打电话竟然说忙顾不上，还挂电话。在送来的也是坨的，而且还超级咸，是故意的吗？以后不会在点了。
1,好大一个饼
0,菜品做的也就那样，水果沙拉基本上都是梨，汤没味，感觉像是前一天剩的又加水煮的。
0,干净卫生个人感觉不错
0,小炒肉整成回锅肉~~~~~、
0,送来的肉丝炒饼是凉的商家的价格不同
0,"把我点的菜都给忘了,10.30下的单,12点10才到,我能说什么呢"
0,"我明确的写了发票信息,结果送餐的硬说我没要开发票,订的是30的套餐,但是送来的盒子上面贴的是12块钱的标签,如果按照价格来说应该是20的套餐,因为不是本人吃的,具体也没问是几荤几素,因为是后来才发现的,就懒得找麻烦了,总体感觉不太好"
0,可能天热放坏了，吃完晚上拉肚子了。卖相也没有店里的好。
1,好吃，清淡不油腻
1,速度超级快！百度外卖超好用！
1,今天的牛肉烧烤饭，感觉牛肉有些不新鲜，送餐员的速度还是很快的。
0,"速度很快，表扬！,但是口味太淡，饭菜也凉了。"
0,皮蛋瘦肉粥点了两份送了一份。撒的袋子里都是。
0,"真泥马难吃。没有酱。一星都不想给,送的又慢"
1,好香啊，就是稍微有一点辣
1,送餐迅速，味道好。
0,"菜少水少,什么都给的特别少"
0,定了一份菜一份饭，结果快递送来两份一样的菜，酱油炒饭没送。可真够粗心的
1,超级好吃~明天还定~
1,"速度挺快的,赞一下"
1,够爽，好吃，一个人吃有点多
1,蔬菜稍微有点咸。。。。。
1,好吃实惠速度！
1,"漏发了一个泡菜,店家很快联系补发了,服务很好"
0,太少了，欺负谁呢
0,简直太难吃了
1,"手工花卷真的是不错,有小时候的味道"
0,太过分了，没听说订餐还得要求一并送筷子的，没要求就没有。没筷子怎么吃啊，真服了，以后再也不定了，真过分！
0,慢死了！！！！！！不怕饿死的可以订……
0,"粥里面都是虫子,一碗粥里面找出五只虫子，给店方打电话还说不可能,，我有照片！！！"
0,吃饭时候都已经饿死了！！！
0,根本就没给我送到，让我等一下午。
0,送来的太晚，而且备注了不要辣，结果超辣
1,"饼好吃,送餐师傅也特好,送餐师傅辛苦啦"
0,东西有些小贵。
0,十分不理解为什么要用塑料袋直接装，看到都没有胃口了。想剩菜一样……
1,"非常好吃,量也大,送餐小哥工作认真负责,棒棒哒~"
0,饭量有点少
1,油稍微大点。总体还是不错的
0,简直不能更糟糕！！！汤汁流得到处都是，并且图片与实物差太多！纯素卷里根本没有绿色蔬菜
0,慢，没带餐具，饭到我这就是快凉了
0,今天这个送餐的让我太无语了，电话接通就喊“出来拿外卖”。我30秒不到走出去就没人了，一看外卖在楼道内垃圾桶上放着。永远不会再订这家了，太差劲！！！
1,百度骑士人好速度快！
1,道菜的味道还可以，配送很好，服务很好。
0,辣白菜五花肉饭，一共只有3块半肉，全是辣酱，比第一次订差了十万八千里，到底有没有标准，这样的饭这个价太没天理
1,送的超级快~~~京酱肉丝卷好好吃
1,还可以，就是米饭偏硬了点
1,一直吃他家湘菜～味道正宗。
1,非常贴心，送餐四十分钟，小哥沟通四秒钟，飞一样的小哥。说还有好多没送。下次再定。
0,除了速度慢，其他都挺好。速度忒慢了，等了一个小时二十分钟。
0,质量不好，量挺多，味道一般
1,分量比较足，但是稍微咸了一点
1,外卖给力煎饼非常给力
0,"世界上最难吃的,羊肉泡馍,卖盐的欠他们家钱。肯定打死的。"
1,煎饼好吃！！！
0,太慢了！没见过这么慢的，11点之前就下单了，足足等了2个小时才送来，饭都凉了！
1,还好吧，在家能吃到爱吃的早点，比较卫生，就是时间长了些，味道不那么好了，不过店家多送了一杯豆浆
0,花蛤和嗦螺里面有沙，没弄干净，味道也怪怪的，不知道食材是不是新鲜的
1,好吃还有优惠
0,根本没有送
0,有点淡，送货速度胎慢了
1,"味道不错,难得的煎饼果子"
1,"快递小哥很辛苦,下着大雪,还辛苦的工作,必须赞,好评"
1,送餐包装很不错，而且送餐很快很及时。要了肘子卷饼和南瓜粥。卷饼味道不错就是尖椒偏多，如果是黄瓜之类的觉得更好。粥有一点凉了，总体很赞！
0,真没有品味多的好吃。
0,点了个帕尼尼，我去！这啥？怎么好意思叫帕尼尼？难吃死了。星巴克帕尼尼，难吃中的战斗机！
0,没给烧饼啊！落下菜了！
1,不错不错，快递师傅也给力
0,越来越小了。。。
0,我第一次吃，不敢再吃了，因为我尝了一下红烧肉感觉肉肯定时间长了有味道，即使炖的咸味也掩盖不住，狮子头也是味道不正常就是肉不是新鲜的，我们是吃东西真是不敢相信他们商家怎么这么不在乎安全卫生、我们的身体还是自己在家吃吧。
0,送餐太慢，太慢
0,3个小时送到！
1,速度快，服务好，必须赞一个
0,等了90分钟！
0,太难吃，是酸的，不干净，还晚送到！
1,"送餐很快,味道很好"
0,送餐有些慢，菜的味道不错
0,八宝菜竟然是咸菜。。。太坑
1,"很好,包装也很好"
0,不解释，时间真快
0,感觉太干了，不喜欢
0,速度很慢，东西也一般
0,别的不说，就这速度也是醉了！做不到一小时就别写嘛！幸好不是等着救命的药！
0,粥很稀，卷饼厚，内容少，等待时间太漫长，服务态度还不错
0,好慢。。。饿死了
0,"三十块钱,一小盒都不满,怎么想的,再也不会订了"
0,差评！一点菜没有，咖喱猪排饭一点咖喱也没有，只有两块土豆。送餐时间一个小时！催了三次！评价这个界面的送餐时间也是虚假的，根本不是真正送到的时间！
1,还不错，鱼香肉丝很好
0,飘香肘子卷，里面不是肘子，就是很普通的炖肉，半生不熟的，看着就没食欲。一口下去，唯一的感觉就是：难吃到没朋友！吃了三口，实在受不了就给扔了；包装倒是高端大气，不禁让我联想到老板肯定是把店里的主要资金花在包装纸袋上了
0,12点不到下的订单，都快两点了才送到，饿死了。。。
0,"送的很快,态度很好"
1,超级快，超级快！！！
0,这次味道很咸
0,五十分钟送来面都妥了，第一次订餐半小时送到了，后来就不给力了
0,垃圾店，你的包装袋能别拴死扣吗，费半天劲才打开
0,超级难吃，速度和包装倒是不错，不知卷饼怎么做成这样
0,饭已经都凉了，汤都洒的到处都是。。。味道很一般
0,第一送的时间太晚了，第二里面的肥牛根本不是肥牛，明明是猪肉，不像石锅拌饭，就是蒸好的饭上面放一些菜，唉
1,连着几天吃不腻，赞店家的诚信经营理念，分量还是足足的，味道还是那个味儿，这次的骑士哥赞一下，还是住附近的，很高兴选择了这家美食，订餐那么多天，从没有超过三次的，吃得满意，吃得放心
0,差一个鸡柳，也不知道联系谁
0,几乎只有蛋
0,肘子卷真的难吃啊
0,朋友说今天的菜不新鲜还吃出了头发
0,一直没送到，打电话问说可能单子丢了！！重新做了送来的
0,"拌饭的质量,简直了,难吃"
1,饮料好喝，送餐也神速。
0,很不好吃。
0,10点下的单，要求11:45送过来，结果12:45才送到，中间催单两次没反应，打400也打不通。快递小哥很朴实，12点多才拿到饭，然后风风火火爬步行梯到15层送过来，辛苦了，但餐厅做饭也太晚了吧！！！粥和肉卷味道都非常一般，等的快饿死了
1,棒棒哒！以后还会来滴～～～
0,每次点麻辣香锅都会迟到。这次还好有打五折的补偿。
1,"味道不错,就是有点油"
1,味道不错，价格便宜，量又足
1,"下着雨,送餐很及时,孙师傅很认真,敬业,非常好,！"
0,真是不想评价了，等了一个半小时多，菜难吃
0,送餐速度快，菜的话翅根很好
0,明明还没做，骗我说送出来了
0,商品太差，以后再也不定了
1,优惠很大，味道不错。
1,这次的粥一碗太咸啦，另一碗没放盐。。明明买的都是皮蛋粥的说
1,粥很好喝，送餐时间也很快，卷饼内容很棒，但饼皮希望能再烤熟一些就更好了
0,送餐超时太多，要求要了发票，但发票没给！
0,已经二小时了还未送到饿坏了。
0,外送人实在让人着急呀。不知道路我也是醉了。
0,三鲜饺子里不是虾仁吗？怎么放那么多虾米皮？饺子皮很厚，饺子馅就是一团浆糊，不知道是啥，很难吃。娃娃菜太油了。
1,菜品质量很好，吃货几次了，都还不错
0,不是一般的难吃，再也不来。
1,骑士速度特别快赞
0,写的水煮牛肉，根本不像牛肉
0,土豆没做熟，里面都是硬的
1,准时到达，味道也不错。
0,"我也是服了……摩卡能给做成热巧,真真儿的是热巧~不是咖啡！！！不怪派送员，杯子上标注的都是摩卡，里面居然是热巧……星巴克错单，也挺难得的：）"
0,"卷饼里面吃出红色塑胶线,！！"
0,备注了多带点纸巾和酱料，结果纸巾一张没有，连番茄酱也一包没有。。。餐送来基本凉了，但是和约定的时间是一致的，没晚。
0,面整个是一坨，没法吃，差不多一个半小时送到
0,一般都是会订有些名气的，之前也定过别家正一味，但从来没有想到这家会做的那么差~！2小时后才收到。如果不能送可以在订单时告知客户，尽快取消没有什么的，但是。。。。送餐人员也将近送了1个小时。。。很无语
0,"首先外卖人员非常辛苦，服务态度也非常好！！最想说的是宫保鸡丁根本就是宫爆花生米，就算是外卖也是眉州东坡的外卖，就算是在忙材料也是切好炒的吧,不是我夸张，一盒菜里我就吃了不到10块鸡丁就全是花生米了，你这也太过分了，外卖就是这样糊弄消费者吗，我再也不会订你家的东西了，并且我的朋友们我也会告诉她们不要订你家外卖，因为这是你们对消费者的不尊重，更是对辛苦送外卖的工作人员的不尊重！！真是败了眉州东坡这个品牌的名誉！！"
0,要了两个煎蛋，只放了一个。。。不过拌饭味道不错。
1,"建议再出款浓情可可，与岩岩的区别一下。,总体很满意啦！百度我支持你哟！雾霾天百度小哥辛苦你啦！百度公司一定要发给他们口罩哦，太不容易了！"
1,略太甜，腻
0,奉劝不知道6寸多大的人不要点……小的惊人。还不如去买张煎饼
0,两个小时才送餐
0,本来怀着期待的心情想体验下，结果收到的咖啡洒了好多，备注着加奶和糖压根没有，哎！真心失望啊！
0,这鱼头也太难吃了！米饭就装了半个盒子，是有多抠门？
0,"菜太难吃了,油太大,肉也不新鲜不会再光顾了,快递员不错！"
1,速度很快，饭菜都不错，就是不够辣
1,外卖小哥服务很好，送餐态度很赞，但是，忘了给我送的可乐了，另外，米饭量很大
0,送餐超级超级超级超级慢，10点30下的单快1点了才收到。。
1,卷饼不错，量足！就是肉太柴了。
1,大号卷饼太大。如果胃口比较大。推荐吃两个中。
0,外卖不好吃，没味道
1,肉很多，包装很好，味道有点不够重，可以多加点料
0,要的是热炒土豆丝，送的根本就是凉的，量非常少，还16元！8元都根本不值！再也不吃这家了。
0,一般般，速度慢口味也不是很好。奶油汤清汤寡水的，披萨饼薄脆太硬，凯撒沙拉的面包粒用的是软的，并且与披萨放在一起来了直接成热菜，菜叶焦黄，伴酱无味。看似唯一好吃点的就是那个串了。送餐速度我就不点评论，和其他顾客一样啊，唉……
0,两个小时才送到，期间也没打电话说明情况，必须差评！
0,"这个送餐员没有给我拿勺子,我点了汤！怎么喝！也没有给我拿发票.我都备注了！！这么多回头一次差评！"
0,"不认路,没零钱,鸡块是腥的"
0,"尖椒土豆丝卷饼夹生,不好差评"
0,什么情况？不是已经打电话说好了取消订单吗？还给不给退款了？能不能有点信誉
1,骑士师傅辛苦了，大冷天的。
1,总体来说，不错，最起码价格便宜，花了四块钱，吃了一个肘子肉卷饼
1,很好吃，也很快，不错！
1,没有放辣椒，吃着不是很爽
0,速度很快，还行
0,卷得和以前不一样啊，锡纸卷到卷饼里去了，吃得到处都是好烦
0,"要的梅菜扣肉给的猪蹄子,囧"
1,青城饭菜很好，配送服务也快！
0,等了两个半小时，客服给处理了半个小时，最后就是默默送过来了，也没给解释一下。为了避免影响好心情，以后是不敢再点了。
1,上次少的粥我在备注里写了，果真送到了。
0,味道还行，就是速度太慢太慢了，不到11点订的，快1点才到。
0,说了不要辣还是辣的！
0,太久了！河粉汤全都被吸收了！坨了呢！不开心=_=
0,"9点40预定,12点半到,打电话下楼了,说送错地方了！！！能不能再坑一点,服务差到极点了"
0,基本都是带皮肥肉
0,好难吃啊，鸡块的油味道好大，面坨了，很难吃，就把煎蛋吃了，其他都扔了
1,"系统bug，我把地址修改了，配送员收到的地址还是原来的，幸亏黄太吉送餐小哥辛苦又给送过来，赞一个！,餐很不错，豆腐脑很好吃！"
0,催单过程中，餐厅服务员态度一般！没说完就挂电话！
1,挺不错的，快递员找了好久才找到，很辛苦
1,"杯子坏了,不过饮料没出来,其他都可以"
1,"骑士辛苦了,不是我吃的不知道"
1,不错不错，胃不舒服才点的粥，清爽，料足。外卖小哥服务态度也是很棒
0,有些菜没有了，换了好几次，不过味道还行
0,饺子真心不怎么样……
1,领导说这是一个非常适合加班时候吃的略带文艺的小卷饼
0,不会再吃了
0,味道不错，但送餐时间也太长了吧！！等了一个多小时
1,味道很棒啊
1,分量比较足
0,以前吃这家挺好吃的，今天吃了下完全没有以前好吃了，这是为什么呢？你家厨师失恋了吗？
1,非常好非常好非常好～
0,"晕了,鸡肉丸10快就那样不满意,吃亏了,拌饭盒子太小"
1,卷饼味道很好，包装卫生，不过男同学一个中份吃不饱......
0,商务十点半左右定的餐，到下午两点了还没送到。打电话取消订单了，为什么是“订单已完成”而且没退钱？
1,"经常买,卷都挺好,第一次买八宝菜太难吃了,建议改改"
1,"好吃,就是有点贵"
1,非常好！包装！和味道！快递也很赞，EMS能这么快，哈哈
0,里面的吃的，都弄乱了，叫我怎么吃。
1,快递师傅特别好～等了我10分钟
0,麻烦给个筷子不行吗！送个小萝卜什么的不行吗！给张餐巾纸不行吗！以前买过别家的会送爽口萝卜！比这个便宜！没筷子只能下手还没餐巾纸！
0,慢到堪比蜗牛！
0,沙拉的密封膜竟然已经撕开了！要是普通餐盒的塑料盖也就不追究了！菜撒出来一半！绝对不能吃了，谁知道中途发生了什么？！
0,垃圾百度送餐，多近的地方就没有一个小时内送到的
1,好极了好极了好极了。
1,吃多了有点腻，粥还不错
1,味道好，干净，包装精致
0,等了两小时，送到后，关东煮汤都撒没了
1,味道不错！店家态度也好！支持！！！
0,"冰糖雪梨粥,连米都没有,就是个甜汤,凉拌木耳里面怎么还有一根黄瓜丝,一根豆腐丝"
0,这送的无语了，提前一小时送到了，嫌饭太烫让我晾一小时吃么。土豆牛肉22不值..不会再订了
0,菜量比在店里吃的少很多，大家注意吧，谨慎下单！
1,送餐很快，肉很好吃，量还可以
0,"味道好一般哦,配料不丰富"
0,饺子本身不错。但真不适合外卖。。。到了全塌了软软的不好吃。外卖特别快
0,太差了！送的都是坏的！要求退了！太无语了！
0,没有以前好吃了，只剩干净卫生
0,太次了，饭里居然吃出来烟头了，恶心死了，而且饭都是凉的
