label,review
0,希望评价中可以增加上传图片功能。我点的冰的，结果派送员说餐厅做错了，做的热的，说给我换一杯，我说算了，热的就热的吧！收到后，已经不是热的了，就是温的，还洒了好多，洒了得有五分之一吧！杯子上，袋子里都是咖啡。派送员说再去给买一个送来，这么热的天，怎么好意思再折腾，就只能收下，希望下次送餐不要再有这种事情发生了。等了大概一个半小时，收到一杯不冷不热的，真难喝。
0,垃圾百度送餐，多近的地方就没有一个小时内送到的
0,"非常差！速度差！饼拿来全凉的！！还弄在锡纸里面,你让我跟公司怎么热！！！！送了3个小时!！送餐员说餐多，这是什么他妈屁理由！谁尼玛让你接这么多的!!若是分配给你,你送不了就别送！!路不好走，路不好走是事实,但需要走你妈3个小时吗！！！！！？差评差评！！！媒体曝光！等着的,没完！！！！"
0,说实话也不会再点了！因为菜量基本比实体店少了一半，实体店两个人点这些吃剩下打包的都比我今天点的一个菜多！十分不满意！差评！差评！
0,两个小时才到
0,送餐块，肉夹馍还好，南瓜饼和三鲜补好。
0,送餐的师傅，服务质量太差，送过来都已经坨了
0,"送错了,打电话要求补送也不送"
0,订了就完蛋了，饿一下午
0,吃出苍蝇和虫子了、恶心
0,"锅包肉太甜了。松仁玉米水太多了,感觉没几个松子"
0,根本就没送到，距离才1000多米，一个多小时都没有送过来（打电话来），还自己确认收货。。。奸商，百度外卖都没有监管麽。。。
0,东西是还不错，就是不懂为什么不能给送上来，我知道你们中午忙，可是也不能天天让我下楼等你们给我送过来吧，我也是在上班呢阿，以后还是不点了。
0,狗屎餐厅，送餐3个小时，还没咖啡，一杯咖啡送了3天，客服电话打了6个以上，餐厅电话一个没打通，老板什么态度，一杯咖啡就不给送了，住店家早些倒闭，谢谢。
0,太差了，外卖骑上是骑蜗牛来的吗？
0,速度很快，味道一般
0,送餐速度太慢2个半小时没送到餐
0,太气愤了，送餐送到小区门口，跟我说车没电了，进不来，要去自己拿，态度超级差，还和我嚷！
0,油都溢出来了
0,"送餐慢,鱼香肉丝的太油了,不好吃,腻"
0,羊肉串太咸，还有些不新鲜。鸡心和鸡胗烤的太老
0,量太小了，对不起价格。
0,极差评，百度你们的配送员太垃圾了。
0,第一次喝红茶拿铁，不好喝啊！
0,我要的是鳕鱼的套餐，可是给我发错了，很不喜欢吃！
0,配送服务太差！
0,送餐速度极慢，从下单到送到用了一个半小时，而且口味很一般
0,晚了半个小时，全都凉了，我要投诉
0,油太多，肉只有可怜的2丝
0,我很少评价，但这个我想评价下，整体包装是纸质包装，肉卷是锡箔纸，感觉挺干净，但是饭我真的是不喜欢吃～以后不会点了
0,"无语O__O""…问苍天"
0,此次肉相对以前很少
0,吃了很多次牛肉蔬菜拌饭，今天明显比以前少很多，不管菜或者饭都差不多之前一半，没吃饱，又去楼下买了份凉皮……
0,送错餐了，定了两个宫保鸡丁，结果送来的是一个宫保鸡丁，一个西红柿炒鸡蛋。索性西红柿鸡蛋也能吃，就直接吃了，不可能等着再送一份。
0,"味道好一般,饼厚又硬。。"
0,味道还不错，但是送餐太慢了，等了整整两个小时！
0,没想到已经凉了，比必胜宅送，差远了。起码那个是热的！
0,老汤捞饭味道有点奇怪，有点咸
0,订单确认速度希望及时些
0,份量真是少的可以，完全不值
0,谢谢店家让我第一次认识到荞麦冷面也是可以做到这么难吃。不要说不会再点你家的冷面了，短期之内都不会碰冷面这玩意了。
0,我就搞不懂了，红烧肉河粉还放辣椒油？
0,电话投诉三次没人理！！！百度服务太差！！！系统错误也没个说话，明明点了两份就送一份，半个月了，每次都说尽快回复，至今没接到过百度电话！！！
0,没有酱怎么吃啊
0,周末八点半的早餐都送成午餐。以后不会再定黄太吉了
0,比萨做的不怎么样，但送餐速度和服务还是非常好的。
0,牛蛙就三块.真的
0,11.30定餐，1.00送到，中有打了4次电话催，生气。。。永不再来。
0,南瓜粥不错，素菜卷一般，跟土豆丝差别不大，就是加了豆芽，香菇，味道不突出。
0,"能再慢点吗,我10点订的，下午1点多才到？再也不会在你家买了"
0,大酱汤，太难吃，和店里不一样！特稀！菜少！清汤淡水的！
0,袋子里洒了一堆汤汁。。。说11点半以后送到，结果11点10分都不到就送来了，问原因，说是这边送得多，顺手就送来了，要是这样干嘛还要写送达时间？有意义么？
0,"送了两个多小时,连个解释都没有,还是我打电话过去问的,醉了"
0,粥洒出很多，配送人让去电梯门口等
0,"送餐人员智商为0,气死人不偿命啊"
0,肘子肉味道有点淡，肉有点硬，有的带着筋咬不动，面饼不知道为什么发红，感觉没有上次好吃了。
0,饭量太少，味道马马虎虎过得去
0,菜很不好，服务态度不好，就连米饭都忘了打包了，说给补上竟然也没给送，竟然连个道歉都没有。。。。差评！！！！！！！！！！！！！！！！！！！！！！！
0,送餐速度太慢，将近等了1个半小时，非常不满意
0,凉皮一般，其他的就不多说了。
0,送餐太慢，等了两个小时，无语
0,"不好吃,都凉了,汤顶上一层大油,送餐时间1个半小时,米饭是夹生的,最难吃的料理,以后再也不定他家了,直接扔了"
0,味道真心不好，五花肉泡菜里面只有泡菜和两片豆腐
0,饭不错，速度慢。
0,经过同意换成蒜苗炒肉了，但是蒜苗炒肉的肉有股馊味。。
0,肉都变质了，还说是新鲜肉，我就呵呵了
0,"菜里竟然有不知道是锅,还是,盘子的碎片,太过分了！！！！"
0,海带丝着实好吃。送外卖的小哥给洒了。满袋子都是那个汁。那个菌菇汤就是坑。居然是速冲的！还巨难喝。
0,送的慢，等了一个小时，饭都凉了，电话咨询也没用
0,不是一般的差，服务差到至极！饭量少的要死！
0,没有筷子！！
0,"没有给餐具！餐巾纸,让人怎么吃饭。。。"
0,"什么米饭,太夹生了吧,再也不点了"
0,不好吃，酸
0,米饭给的不够整盒！半盒都不到！真够孙子的！烤鸭到了以后都没法吃了！唔得太严了！劝大家以后别点了～
0,调味还不错，牛蛙肉老，米饭不好吃
0,"真心不怎么样,虽然有满减但还是感觉不值那个价,说是海鲜炒乌冬面,但是总共就见着一个小虾,好像还有一小个鱿鱼的小爪爪什么的,其他都木有看到,味道也不怎么样,总之比不上其他的,早知道不要这个了"
0,迟到半小时，没有电话。取消订单强行送来
0,食物一百分，速度1分。明明走路十分钟的路程，制作要那么久吗
0,菜量太少，送过来也凉了
0,"味道一般,还好"
0,薯条没给番茄酱
0,真的好难吃，唯一好的就是那个纸袋包装，卷饼皮硬，里面几乎都是辣椒和肥肉，你叫辣椒卷饼得了，辣椒还辣死人，我都说了不吃辣！那个皮蛋粥简直是我喝过的最难喝的粥，一点味道都没有，皮蛋瘦肉根本就看不见，真尼玛坑爹！再也不会买了！
0,"不错,东西很多"
0,"为什么一样的煎饼差这么多？酱料酱料不够,吃白饼一样,椒盐双菇是让我吃白油炸蘑菇嘛,没放盐会腻死,这是晚上很饿苦苦等待来的非常不佳的一次饮食体验"
0,等了快四小时。四点一刻订餐，多次催单，八点多到了，还是凉的。卖家送了王老吉。但是吃凉的还是不开心啊。
0,难吃到爆！鸡肉一点滋味都没有。就鱼香肉丝的好勉强！
0,"配送员态度好,但是买了四种馅混杂一起不好"
0,饼有点硬，不好吃。
0,上午下单，下午才送！怎么索赔
0,"吃到了不说,饺子拿上来就是冰的！！！完全冰冰凉！"
0,好慢好慢好慢
0,不在范围了，烦
0,送的可乐呢？？
0,每次点麻辣香锅都会迟到。这次还好有打五折的补偿。
0,"都歪七扭八的,还都软的变形了,只能说很差,看来大家的评价是对的"
0,下楼自己取，每次都是自己去拿，我要是有那时间就不叫外卖了
0,"味道一般,唯一好处,量大,送餐慢"
0,"花了2个小时才送到的....,以后坚决不用百度外卖了"
0,订完餐后，打电话告诉1.5公里之内才给送，很勉强的给送来了，好像消费者欠他的似的，商家太不负责任！为什么不事先在网上告知？！
0,"真泥马难吃。没有酱。一星都不想给,送的又慢"
0,我还以为是小块排骨，没想到都是肉末，看着就没胃口了。这是我对小渝府唯一一道不满意的菜！
0,点了薯条没送过来，又跑了一趟才送到。可是时间太长不想吃了。送过来的汉堡都压扁了
0,点的套餐，送的单品....
0,味道还行，套餐里有雪碧或可乐没有送！
0,"不好,都没煮熟,再也不吃你家的了"
0,"太慢,太慢,太慢,不好吃"
0,"超时半个小时，还送错东西，并且还少了两杯豆浆，最后打了十几次客服电话竟然一直没人接,呵呵"
0,鸭头全部都炒糊了，味道实在是一般。
0,"土豆肉丝,没见肉在哪"
0,黄太吉纯他妈扯淡，定个饭一个多小时没送，打了两次400，前后说法都矛盾，要是送不了就诚实点说，不用骗，直接拉黑黄太吉加牛炖，太你妈孙子了
0,挺好哒。米饭很足。很容易饱。
0,哎，不好，送的太慢，来了粥都凉了
0,菜的味道略怪，总觉得不新鲜
0,送餐的师傅不错，非常快就到了。很感谢
0,特殊要求写了砂锅豆腐不放海米，最后还是放了
0,肥牛根本不是肥牛，干巴巴的
0,做菜一次不如一次，实在是太难吃了，豆角都是苦的，菜价还贵，本想好吃就算了，送餐慢死了，再也吃他家的了
0,米粉份量比以前少，没以前好了
0,送餐员什么的都像以往一样不错，但是咱们菜量不能少吧.....菜带的酱汁不能少吧...为什么宫保鸡丁饭全是白饭啊...为什么牛肉蔬菜饭里的牛肉那么少啊.....
0,太慢了！没见过这么慢的，11点之前就下单了，足足等了2个小时才送来，饭都凉了！
0,"哎。。。完全没法评价这个送餐速度。。。竟然送了104分钟，我真是醉了。。一个小时的时候跟我说送出来了。。然后过了44分钟才到。。有这么欺骗消费者的么。。你说人太多就算了。我订其他家的。。真是过分啊！,而且之前一次也是送了1个小时14分钟，再也不定这家了。。太垃圾了"
0,要的煎饼套餐送的油条套餐
0,能不能不要一份餐等3个小时，是想饿死顾客吗
0,订歺后2小时才到
0,不是很好吃
0,餐还没送到就完成订单了，还等半天自己下去拿。这次太不给力了
0,金手勺你家血肠我特别喜欢吃，可是你居然没有单份的了，我恨你
0,还可以，喜欢吃素的。
0,"菜品也太少了吧,第一次见这么少的"
0,稍微有点儿腻，要是再多些菜就好了，不过总体还是很好吃的。
0,减量了吗，没有咸淡味，菜也很少。
0,"4个钟头,大家自己想想吧,这样的店"
0,少送了个盐酥鸡～说稍后联系我～连个屁也不放了～真恶心～
0,饮料洒了！鸡柳软了！
0,凉透了，汉堡王出餐太慢
0,"真是宇宙那头送来的卷饼，足足两个小时。,哎，天气原因，也是醉了"
0,"感觉跟说好的不一样，不值这个价钱，石锅拌饭的鸡蛋都变成鸡蛋饼了,而且还没酱"
0,28块钱的皮蛋瘦肉粥，只有几根干巴巴的肉丝，还比不上早上街边两块五一杯的皮蛋瘦肉粥呢，商家居然好意思拿出来卖，人才。
0,慢的要死，3个小时的苦苦等待……1.15送达
0,送餐太慢了，足足等了两个多小时，说好的12：30送到，13：30才送到，送过来的全凉了，一点热气都没有
0,送得很快。但是那晚筷乐家园餐盒装的鸭汤散发着臭味，没敢喝
0,粥洒了很多，味道一般
0,相较于平时略慢并且可能是由于在高峰期的原因肉比较凉饭没有浇汤汁海带丝也比平时少这并不是我的错觉因为我每次都吃这两样.....宫保据说也比上次的差一些所以我决定下次避开高峰期
0,"送餐晚了很久,什么都不说了"
0,一个多小时才送到，真是等不起啊
0,可能是订餐的人太多，这家的快递一直都慢！
0,太辣了，辣椒太多
0,"太咸了，盐不要钱么,,,,,,"
0,真难吃！来了粥全抠了！也不带餐巾纸！咸菜牙碜！粥枣核个牙！
0,"都洒了,还超时,不好"
0,7块钱的拌饭真的是不好吃啊！
0,勺子碎了。这次时间有点长。
0,难吃，还贵，明明在线支付了25元，饭到了，单子上却显示支付了18.85元！这是怎么回事？
0,米饭少了啊，备注中要求加米饭，一点反馈都没有
0,送的河粉不是肉丝炒河粉加卤蛋，给我改成排骨河粉，有点无语
0,挺好吃，送餐快。
0,太难吃了，特别是炒米条
0,~味道真的不太好
0,送餐太慢了，味道不错！
0,米线是碎的，太难吃了，吃过的最难吃米线，还38块钱
0,没有什么味道
0,拌饭咋没有鸡蛋呢，严重怀疑给我少送了，不爽
0,口味比较淡，一般
0,冷面不好吃呐…
0,没味，肉和菜切的块很大，没有酱料干巴巴的，饼是那种跟吃烤鸭或者京酱肉丝时候的那种饼一样的，不是烙饼，总之不好吃。
0,"两个小时才送到,非常差,不会再定了"
0,十一点半下单，一点四十才到
0,你们的菜品质量已经刷新新的下降高度，店家你们知道吗？这么好的地方美食你们忍心做成这样吗？
0,"太慢了点吧,将近两个小时,一次郁闷的订单"
0,鸡肉的有点淡
0,"送的比较慢,等了一个多小时"
0,30块的饭，菜量太少了。就一个肉菜，根本吃不饱。
0,味道还可以，但是送到时间也太长啦，十一点二十下的单，到下午一点半才送来，打电话打不通，打通就告诉已经出来啦，打了三四遍电话才给从新做了送过来，气愤呀
0,一个多小时才送到，已经坨成一整块了你让人怎么吃，我就呵呵
0,不如第一次好吃了呢
0,尼玛，十一点不到餐就送来了，你家10点多开午餐的？上次一单两点多还不到，第一个询问电话说我已经收到餐了，第二个询问电话接了说帮我问问，然后就没然后，电话放着忙他的去了，第三个询问电话说没把我的订单看漏了，麻烦跟客人打马虎眼的时候统一下口径好吧？没其他评价：去年买了个表
0,卷饼还是比较好吃的
0,为了送货上门，他为了节省时间，小炒肉都是辣椒，我宁愿你都是芹菜！比第一次吃差远了！
0,一般吧味道
0,菜量太小了，而且还不好吃，送外卖还不拿零钱，太他妈坑人了，筷子都不拿，下次再也不点他们家的了，
0,"我要的是酥肉套餐,，结果送的是扣肉。这怎么评价呢，扣肉味道还行吧。"
0,非常差！太垃圾了今天
0,这石锅做的也太差了，还得自己扮拌啊，而且菜还那么少，就给两包酱汁，这叫石锅拌饭啊，米饭是凉的，只能说很失望，以后不会再来。
0,这次的菜不一样，都是我不能吃的
0,真的超级慢！晚了有90分钟吧。退单电话也打不通。没办法只能等。本来想拒收的，看送餐的小哥也不容易。哎。
0,"每次的量都小的可怜,不知道是不是因为用了减免的原因"
0,三鲜饺子里不是虾仁吗？怎么放那么多虾米皮？饺子皮很厚，饺子馅就是一团浆糊，不知道是啥，很难吃。娃娃菜太油了。
0,较之前还是吃的时候腊肉量偏少，不知是不是商家减量还是偶然的情况
0,"分量很小,,拌饭还是凉的"
0,"催单,电话打不通,三个小时才送到,不会在定了"
0,美式洒了好多
0,赠送的黄飞红花生呢？没送啊！！
0,迟到，到了以后告诉我黑椒牛柳没有了，只能换了个排骨的。送餐组织得很差。
0,腊八蒜呢？没有
0,今天的南瓜粥是酸的！！！！
0,他家还是卷饼好吃...蔬菜拌饭太难吃了....本来想吃点清淡的，打开一看一层洋葱混着卷饼里的酱....下面依稀有些土豆丝豆芽抽吧的蘑菇片.....真的很难吃啊....不过卷饼是真的好吃，下次还是点卷饼好了....
0,写了要去冰少糖没有按要求
0,送来都冰凉了
0,付完钱发现没有给我优惠，打电话问客服，说我软件版本过低，我每天都在用，就今天告诉我这个？商家也不给取消订单，付了钱你们就把这钱吃定了？
0,点了1份九品三鲜，2份茴香猪肉，结果送了三份茴香猪肉过来！！餐具也只提供了1份！！里面的调料包，三份饺子，只有两份调料包，醋包还全洒出来了！！承诺12点15分前送到，结果还是超时了！！
0,送来都凉溫了！！！
0,这次味道很咸
0,口味一般，感觉不是肘子肉
0,"店里送错了餐,给店里打电话,话还没有说完,对方就挂断了,特别没有礼貌,实在是差"
0,送的太慢了。。再晚来一会我都准备退单了。。。慢的无与伦比啊
0,肉有点硬，不如肉夹馍里面的肉好吃
0,上门取餐的，为啥还收1元？而且还不配给【盒装饮料】。。
0,吗的百度外卖快倒闭吧，草泥马的每次都要两个多小时。冰粥都热啦
0,本来为公司同事订餐，18个披萨，一共871元。不给发票，到现在也不给送。公司订餐变成个人请客……，从此封杀你家，再不点你家外卖。
0,差评，超级慢，没有在规定时间送达，还要自己到店里去吃……态度还超差
0,"沙拉不给酱而且开封了居然,也不给餐具,一点十分送达却显示12点半送达"
0,送餐太晚了，饿死！
0,失误了，没看地址，太远了，等了两个多钟头，这是逼我刚到单位就订午饭的节奏啊～
0,难吃…太难吃…真的很难吃…
0,明明要的芥蓝，来的却是生菜，不是一个档次
0,实在是太慢了！
0,太慢太慢，粥就是水做的
0,不是怎么好吃，一般吧。
0,土豆要多煮一下
0,"太难吃了,已经想不到用什么词,来形容难吃了"
0,受不了了，17点32下的单，19点15送到，饿晕了，再也不会买了
0,味道还行，比较辣
0,等待170分钟
0,差点饿死我了
0,漏送了，最后补送了。皮蛋粥真心有些不好。
0,难吃，快递脾气很大
0,"呵呵,，,真可以，之前感觉您家特别实惠。没想到这次缩水到这种程度！！！一共就这么几块肉！"
0,一份米饭还能再少点吗？？？？？？百度服务没的说，5星
0,这东西真不能点外卖，汤撒的哪都是
0,太辣了，送餐速度慢了点，等了两小时
0,"送了一小时.......,大拌菜里的蔬菜,有点焉"
0,太难吃了吧，怎么会这么多人推荐呢
0,病人吃啊，挂面哈拉味，汤也腥。
0,送餐速度慢了。有一份菜吃起来感觉没放盐！菜品一般！
0,百分百差评，米饭特么跟粥一样黏糊糊的，怎么吃啊！！！！第一次遇到这种情况！不是米饭，是大米粥！！！！
0,早点定的是两份8元煎饼果子套餐，苦等了1个多小时，结果送的是两份油条套餐，重点是说会补送，以为这服务真心不错，结果就杳无音讯了！
0,神速啊。特么完了快一个小时，真牛逼
0,昨天订凉皮两份，什么调料都没有放，就放了点麻油，特别难吃，丢了一份，再也不想吃了
0,味道不如龙旗广场店好
0,在店里用百度外卖下的单，收了配送费，但是不送饮料～我和我的同学，我们班的同学，都不会再来了～
0,肉里夹着一根头发！整盆都黑乎乎的让人看着不敢吃！就是一大盆黑色！打商家电话提示空号……太无语了！
0,"煎蛋，香肠还行。肥牛太老！！菜花难吃！,最sb的可乐是热的，一打开喷的到处都是！,盐酥鸡上面的面太厚太硬！！"
0,送到了已经凉了...
0,他家太有意思了，一共要了一个卷饼，2个豆浆，送到发现少了杯豆浆，找客服解决，最后让下次订单备注一下，会多送1杯豆浆，吃个外卖还带预付款的，新鲜了～
0,披萨没熟！！！大差评！！！
0,订餐后一小时还没送，给黄太吉400打电话也一直忙线，最后是给百度外卖的400打电话才给催了
0,九点多顶的，预计11点送达，结果催单了11点才给送，12点半才送过来
0,11点下单，1点多才到，等两个多小时，本来想不要了，但是看送餐的人太可怜，勉强收下了。下次还等这么久绝对拒收！差评！！！
0,我本身是口味偏重的，但都觉得菜咸得不行不行的，配送连餐巾纸都没有，而且用的是超薄的塑料袋，实在不想再吃你家了！！！
0,虽然快递小哥送来单时连连道歉，但是也夸张到等了两个小时。等待期间我打了两次商家电话都是先是没人接，后提示电话是空号。另外我的备注，快递小哥表示并没有理睬。给两颗星是多还是少？
0,"等了一个半小时餐送错,菜已经凉了"
0,送来的太早，都不知道备注送达时间有什么意义！
0,宇宙卷饼是饶了宇宙一圈才送到的吧，等了2个多小时也是醉了。
0,送晚了，配送员送错地方，面都断了！没嚼劲！汤洒的到处都是！
0,垃圾到家了！！！什么送餐速度！到了都是凉的！
0,"每次酸奶都不给我带吸管,心好累"
0,"饼难吃,肉不入味,送了一个半小时,量特少"
0,薯泥太湿了，口感很怪，味道不好，提拉米苏少了一角，被惊到了~望以后注意
0,"有点慢,送来都凉了,而且也不太好吃"
0,"送餐速度还可以，就是没有番茄酱！！！！！！！！,没有甜辣酱！！！！,没有餐巾纸！！！！！卖家能不能上点心，真是不负责任，差评！！！！！！"
0,卷饼味道有点淡，肘子瘦肉有点多，太有嚼劲
0,现杀猪都比这快，打电话催了一次，结果半个小时以后还没送到！跟我一起点的比我的早到四十多分钟，落单了吧！打电话催就敷衍一下，真是没谁了
0,送餐时间有点长，凉菜海带丝没洗干有沙子
0,"煎饼都凉了,全压瘪了,豆腐脑也没有店里好吃,薏米水还可以,但是没拿管。。。"
0,量太少了，不够吃，都能数过来
0,油太多了。服务态度好。
0,菜送到都凉了
0,不给筷子跟餐巾纸的。也太省了吧。宫爆鸡丁量还可以。焦溜肉片做得跟锅巴一样硬咋吃啊。就这一会下次绝对不定了。
0,50块买了碗汤和两坨米线，呵呵这钱也是好赚，知道为什么评价这么低了
0,不是鳕鱼，骗子！
0,"商家态度差,，送来的餐品全洒了"
0,麻烦下次送餐能不能确认好再给？自己送错了反倒麻烦我楼上楼下来回跑好几趟，我点的多就应该送错是么？神马鬼理论，1分都不想给
0,2小时啊，可怕极了
0,配送员提前太久打了电话吧，零下十五度让人穿着睡衣拖鞋在外面等了五六分钟
0,太慢了，送了90分钟。
0,商家包装质量太差，汤都没法喝。配送人员服务态度好
0,大份薯条只装了盒子的一半！
0,这湖南大白菜还参合一些别的白菜，这好意思？这腊肉是湘西腊肉？还是北方熏肉？坑谁呢？
0,"3点50订,4点10分才去取,40才送到,500米送了30分钟也是了得,拿这我咖啡晃悠了半个小时,两杯咖啡都晃洒了一格的量,你不认识道到是给我打电话啊,我给你打还提示说请加区号,我就去,我知道你哪的啊"
0,挺好的，速度很快
0,送过来已经坨成一坨，吃了几口，就扔了；在想怎么会有那么多人推荐，这么难吃
0,预计12:17送到，但事实是1点才送到，而且汤汁全洒
0,时间也太久了，还不是用餐高峰，足足等了两个小时。
0,居然没有吸管，请问要怎么喝
0,草泥马，什么玩意这是，是饭么。坑爹呀
0,非一般的慢
0,菜和米饭都很少，根本不够吃，送餐没到居然自己点已送到，真搞笑！
0,这是一麻一辣吗？所有的牛蛙都是糊，经典的牛肉丸别说弹性，都干的咬不动了！这是一麻一辣？关门吧！还不如街边的小摊
0,口味不错，很快。很热
0,可以改名叫全宇宙最慢卷饼了，10点57分下单，12点45分送达。。呵呵了。
0,点完了东西说没有，没有就不要放在菜单上菜单需要更新，然后外卖员各种先送别人的最后才来我家咖啡也洒了也凉了，蛋糕也不是我当初点的
0,东西没问题，连锁快餐谁做味都差不多，范个懒想吃汉堡了。快递太肉了。。。11点下单一个半小时后才到，又不是高峰，有待改进
