label,review
0,味道跟餐厅吃差远了
0,送不到就不要接单好了，上午十点半下单下午一点半才送到，打电话店员态度不应该诚恳点？你还有理了？卷饼味道一般，凉的，像是剩菜。
0,"什么破东西啊，10点半定的,1点送到的"
0,除了粉之外，其他的配菜有点老
0,东西不错。就是到店里找去了，饺子没有，换的肚丝巨少一两左右，说肉多给了。下次请说明换的有多少量。还有买了三次饺子都没有，既然没有就把图片撤了。
0,太难吃了，第一次吃到这么难吃的石锅拌饭和辣牛肉汤
0,送餐很快的，味道也好，就是麻辣香锅里花椒多到和菜纠结的抖不下来，真没法吃。米饭很大一盒。
0,虽然送晚了，但是商家的太度还是可以的
0,"石锅拌饭真心不好吃,尤其是豆芽菜特别噎嗓子,冷面凑合"
0,你们家是卖盐的么，把菜弄那么咸？
0,送的太慢，最慢一单两个小时都没到
0,到餐时间真心很长，送餐员就说了个路上堵车然后拿钱就走了。。。。。
0,和送餐师傅关系不大，问题是商家没有装够东西，漏放了大薯条，最后补了一个，感觉不像大薯，应该还是中号薯条。习惯好评。没有给差评的习惯。第一次给三颗星。
0,"20的感觉一般,不如15的好呢."
0,一个半小时后到
0,超级难吃，这里厨子都是给牲口做饭吃的
0,垃圾，不要订
0,太慢了，送了两个小时
0,图片仅供参考
0,吃完就肚子疼，一晚上没睡好！
0,我在北三环，结果送到南五环去了。害的我等了一个多小时才吃上饭
0,差评，真的不是想吐槽。我也是个差不多就行的人，不过这个也差太多了。订单100多分钟才送到，期间多次打电话催促回应也只是催单，这也就算了，说好的不要葱花香菜等100分钟送来的还是带的，而且送来以后煎饼都软了。我平时差不多的都是给满分，但今天这种情况真是得吐槽一下了。
0,东西很少，像半分每次都是这样失望
0,第一次买，也是最后一次，拉的我都虚脱了，吃肉夹馍+酸辣粉拉=拉肚子，肉夹馍+凉皮=拉肚子，
0,为什么没给我开发票？？
0,关东煮送来汤都颠簸没有了。外送了很多次和合谷就这次不好
0,太慢了，以后不点这家了！都凉了
0,"。。。虽然很好吃,但是披萨里面的纸是怎么回事!!。。。虾上面,缠着的,有蓝色线的纸。。。"
0,第一次给差评，凉菜汤洒了半塑料袋，菜全堆饭盒半边，还不够我收拾的，送餐的耍双截棍改行的吧
0,这菜我也是醉了！不管是订的还是送的！难吃到这样~我也是头一次见
0,"特别写了酱油炒饭不加蛋了,结果还是加蛋了"
0,菜不仅难吃送的时间还超长
0,等了2小时，送来是凉的，特别难吃还，无语了
0,送来的菜，油汤都流出来了。弄的满袋子都是。菜品味道很一般。
0,送餐员态度不好，餐送到了还要客户下楼取，你怎么不让客户直接去饭店取。餐品一直很好，请继续保持
0,等待了105分钟，还是在投诉的情况下才送餐
0,就薯条还行！其他都不怎么样！
0,鸡蛋太少都是酸豆角
0,"晚到,饮料也没给,很失望"
0,上午订餐，两个半小时才送到
0,菠菜没洗干净…
0,饭和菜一共就半碗，一个鸡蛋也没熟，没肉，30，真差！恶心！
0,11点以前就定的餐，做了1小时48分钟，呵呵，我只想说：拜拜！！！
0,慢！！！提前订也白搭
0,蓝莓山药送来的时候是坏的，打电话回商家反应没有诚意处理，一直说蓝莓本来就是酸的，还让我在电话那头等待了8分钟，最后受不了了，把电话挂掉了
0,不好吃还晚点！
0,鱼可以，豆腐这次好像没盐。主要是送餐太慢。要啊饿死了。
0,"太慢了,一个小时二十分钟才到"
0,她妈的还要餐盒费，太坑爹了，一个盒要一块呢，一个餐盒批发5分钱，打包要一块
0,"这个非常的不行啊,，，，我说的12点15送到,结果11送到的,公司的人都在工作,影响非常的不好啊"
0,"做的不够精细,凑合吃吃也还好"
0,味道不错不过时间太长俩小时才送到无语了
0,送的太早，吃的时候都凉了
0,口味还行吧。。。就是送餐太慢太慢太慢了。。2个小时啊。。
0,两个半小时，不是一般慢啊
0,再次没有带发票，居然还跟我讲没看到备注信息！
0,量太少，肉就几片，全是辣椒，排骨全是骨头，怀疑被剔过。
0,馄饨还可以
0,一盒炒饭两个鸡腿半个煮蛋一盒果汁，炒饭像咸菜，还好鸡腿没什么味儿，可以就着咸菜吃。果汁味道还可以。
0,奶盖红茶送成柠檬红茶，给你们打电话后说要给我回话然后等到现在也没有
0,"1.前一天有同事在这家订餐，送达时间早了一小时；今天送达时间晚了一个小时。,2.给商家客服打电话，找了一堆理由推脱。,3.打完客服电话后送餐员打过来2个电话，装作找不到路，送达后解释说第一天上班，被前一天订餐的同事认出是同一人。,4.,2.5公里的路程，送餐员步行送餐，送达后所有菜品完全是凉的，没有一点温度。现在北京的天气刚刚过完大寒！,5.第一次遇到这么差的外卖，以后不会再订，劝告商家做不起外卖就不要做。"
0,不好吃，太薄了
0,"送餐员差评,投诉,超次"
0,我的煎蛋呢，少了煎蛋，是不是应该退我煎蛋钱！！
0,"可乐全洒在袋子里了,怎么喝！"
0,和想像的有挺大差距。
0,"灌汤酥肉套餐,也许是我的味蕾坏了"
0,味道不错本来想给五星，但是看推荐才发现我订的冒菜里的山药没有这怎么算啊？
0,2个半小时，我也是醉了
0,"送的挺快的,但是我备注的辣椒去哪了？,还有韭菜鸡蛋的鸡蛋又去哪了？而且韭菜鸡蛋的比韭菜肉的还少一个,难道现在鸡蛋卖的比猪肉贵了吗,好奇怪哦"
0,真的好慢啊！等了将近两个小时，快饿死了，只好自己出去买了，刚买回来才打电话说送来了……
0,巨慢无比，我催单，店家态度还很恶劣
0,"味道一般,送餐很慢"
0,不值17元！我要的是肘子，里面加了一半鸡肉，不如大街上手抓饼加两块里脊，皮蛋瘦肉粥6元不如早起2.5元的实在
0,"太慢了,1.10才送到"
0,100分钟才到...其他的就不多说了
0,再也不会点了…微辣做成中辣…一大盒里没几块肉全是姜和蒜…送餐那人吊到不行…真是醉了…
0,"一个小时四十多分钟才到,咖啡洒的哪里都是,要的热咖啡,到了已经凉了"
0,"口感一般,卷饼有些硬"
0,还不错，送餐师傅很给力！
0,羊肉串好难吃，又小又硬
0,"这家的菜是人吃的么,给狗狗都不吃,简直太难吃了,鱼杂豆腐是苦的,火爆肝尖又黑又腥,鱿鱼没处理干净,鱿鱼都没处理干净就送上来了,一共点了三个没一个能吃,全倒掉了,以后不要去这家买了"
0,两个多小时餐才到，上次也是一个多小时。服了
0,第二次点的飘香肘子等了近俩小时，饼有点凉了不说还特别干，肘子肉做的特别老，还没有刷酱，这样子生意怎么做啊以后
0,速度超慢，饮料没送
0,米线都是糟的，配菜少到单点的鱼都找不到，豆腐的酱汁也洒的哪儿都是，全浪费了
0,迟到了30分钟
0,味道真不咋滴，送餐送到汤撒的到处都是，差评
0,"晚了一小时,要求赔偿,给我回电"
0,不知道是送错了还是本来就分量少，我这个大份的，特别小。。
0,送餐时间慢得不得了，两个小时能到就烧高香吧
0,鸡蛋没有熟！！！
0,说了不吃辣。。。送来的还是辣的
0,"店里马上放假人手不足，等了一个半小时，终于送来了。,不过菜做的都比较咸，原来配的圆白菜没有了……换成了类似腐竹细丝但不能确定是什么的东西……还不如圆白菜爽口,红烧鱼块淀粉较多"
0,没吃过这么难吃的水煮牛肉，刚送来吃一口就扔了。有股膻味
0,烤韭菜也太少了，也没刷酱，蕨根粉的黄瓜丝切的真牛逼粗的能当筷子
0,"不好吃,一点味儿没有,肉根本嚼不烂"
0,十点五十定的十二点四十到，肘子感觉有点怪味，肥肉里面还有瘤子，不会再点了。。
0,本来怀着期待的心情想体验下，结果收到的咖啡洒了好多，备注着加奶和糖压根没有，哎！真心失望啊！
0,菜品一直不错，但及时的送餐速度，也是好外卖的必要条件！
0,比卷饼差多了
0,"晚了一个半小时,而且都凉了"
0,根本吃不饱，还贵
0,味道很好，分量好像比在店吃的少。
0,今天送过来的两杯咖啡底都漏了，洒的衣服上，地上哪都是，很不好。第一次这样，希望以后不要出现这个问题了。
0,大周末居然1小时20分钟才送到，而且油特大，不好吃
0,感觉比在店里吃的时候粗糙很多
0,等了两个半小时才到，不想说什么了
0,"订完餐到给我打电话接餐用了两个多小时，给我打电话接餐到见到外卖小哥用了半个小时，东西东西显然已经冰了，吃个屁啊还？,科科"
0,订了一份餐，1个半小时才送，本来和同事一起定的，只送了一份，还说让我们自己联系，没见过这么差的送餐
0,终于赶在半价以前把晚餐送来了，实在是“感谢”！饭盒一看就是装盖饭的尺寸，如果是这样就不必多花那几块钱。菜的颜色早已不新鲜，看来是吃了中午的剩菜。除了快递员还知道有些不好意思外，实在没有什么可值得称赞的，放了勾芡这些已然没必要再提了。
0,超级差评！两个小时！！！
0,吃正一味，如果你没信心等，那就别点了，86分钟，我快出现幻觉了，以为订的下午茶呢，想想这速度，都醉了。。。。。
0,疙瘩汤比学校食堂都差，没这么糊弄的！扁豆面，基本都扔了
0,我一直喜欢吉吉熊可是昨天的饭里竟然有瓜子壳？我擦！
0,海带烧肉真心吃不了，海带居然是酸的，都没吃，其他倒还不错。
0,口味一般，焦溜丸子不好吃
0,"我能说我没有吃过这么。。。。算了一人一口味,等了一个多小时真的太失望了。第一次吃也是最后一次了。。。"
0,备注了放辣椒结果也没放，煎饼口味很奇怪，是甜的
0,臭桂鱼一点都不入味……荷塘三炒不知道为什么发酸，感觉像坏了，没吃，全倒了。送菜速度倒是很快。
0,菜的味道还行，不过肉不是新鲜的。隔夜肉！其次米饭是前一天的，有变质味！
0,翻得一塌糊涂，备注要的东西一样都没给
0,送餐太慢一个多小时
0,等了整整153分钟!期间30个电话都死活不接，各种撒谎!我们四个同事一起订的，坑死了好吗？百度外卖客服也打不通!坑爹!再订你家我是你孙子好吗？
0,外卖不给餐巾纸的吗？
0,"肘子卷太油腻,可能个人不太适应这个肥肉,味道真贵还好"
0,承诺半小时送到的餐，从11:38等到了12:18，送餐的师傅还说，承诺归承诺，可不是一定能做到，呵呵。
0,送菜太慢，过了高峰时段人都走了，一个多小时还没送到，电话取消后，不知怎么退款
0,我的发票呢？为什么没有啊
0,没送辣酱，差评差评差评
0,垃圾！送到都是凉的！完全没法吃！效率简直就是渣滓！
0,米法子形容，，生煎成了包子。。。馄饨汤都洒在了袋子里。。哎，，这。。。这。。太纠结了
0,我要求抹茶拿铁不加糖，为什么还是加糖！
0,要了三个汤，三个都洒了，而且说半小时送到，实际花了快一个小时
0,肉太少，块小跟其他店差不多，就五六块可是很少.剩了一堆白饭，真浪费
0,一共买了3个芒果，两个是生的。
0,送餐时间有点长
0,每次都不看备注吗？说了去冰！还带冰！
0,卤打的还行，囊质量差了点儿，配送比计划晚了一个多小时，严重不满意。
0,配送员说饭馆做错菜所以晚了，期间没人和我联系过
0,写了要发票，结果不提供，东西量少，质量极差！
0,不怎么样！配菜都不齐，等了俩小时！
0,饼里一点酱都没有，干巴巴的没味道
0,等了2个小时15，让我去一楼取，等了10分钟，也打不通电话，看不见人，都一点半了送过来，还让我下楼去取！以后坚决不定
0,没什么味儿～～
0,服了你们的外送员了，五十米的路程走了半个多小时
0,"等了两个小时,无语"
0,鳕鱼口感太老了，总体好，性价比好！百度外卖+丽华快餐好！
0,这送外卖的小哥是在梦游么？每次要么我下去了等了半天也看不到人，要么就是和别人聊天去了。你要到了再给我打电话好么，别每次让我等你！！！！
0,建议两个小时前订餐！
0,咖啡撒了些出来
0,订三份送来两份，有一份还送错了，
0,送餐时间，1个小时20分钟！！！！！！电话催单，直接挂客户电话！！！！什么破服务态度！！~！~~！~~~差评！~！！~~~~
0,等了两个半小时才到。
0,要了粥，没勺子怎么喝？
0,好难吃，说是酥肉，其实都是大肥肉，味道也不行，第一次百度订餐，印象很差劲
0,餐盒好看，菜量也多，但是吃完后下午反胃，应该不会再订了
0,太慢，我都放弃睡觉了，睡了一小觉才送来，面都泡囊了
0,米饭比其他家的少，菜跟你想的可能不一样，铁板肉酱豆腐是甜的，干煸四季豆花椒太多了，不难吃，但要有准备菜的味道不是你想象的。
0,菜品很一般哦，只能凑合
0,好难吃，什么味都没有，还被店摆了个乌龙。。
0,都说不要甜的啦！
0,粥连个勺子都没有，还凉的
0,排骨咸的要命，简直没法吃。牛肉面更咸了。都可以飞上天了。再也不想吃第二次了。
0,怎么说呢，最满意的是包装，哈哈，味道和想象的差好远，饼好硬，哎╮(╯▽╰)╭，不过挺便宜的
0,时间太慢，送了一个半小时，但是很好吃
0,"送餐太慢了,等了一个半小时"
0,预定时12：40好像是，写13：33送达，快3点了我还没见到饭，也没人给我打电话。最后一姑娘敲门说这是你的餐吧，好像送错了送我那去了。我好无语啊！
0,挺不喜欢给一般的评价的。腊八，特意提早到十点半订的餐，结果还是晚了近一个小时。肉饼和糊塌子都凉了，而且特别的油，菠菜老的嚼不动，黄叶子都在里面。也不知道说什么好了。
0,太慢。两个小时了
0,韩式鱿鱼饭，味道可以，就是鱿鱼太少了呢。。。
0,量少了些，配送时间稍微长了一些。
0,"耍流氓、、、牛肉呢~,！"
0,粉很好吃，就是配送员找不到位置还一直埋怨，送来时已经坨了！
0,红烧鲫鱼简直无法直视，32块钱两条小小鱼，还没鱼缸里的锦鲤大呢，鱼肉非常少，薄薄的一层，鱼刺超级多，不说了，满满都是泪…
0,没有以前好吃了，肉都坨在一起，不香，口感也不好。
0,没有我喜欢吃的小苏肉了
0,饭和汤都是凉的!
0,菜里全是汤洒了一袋子。。
0,菜品不怎么样
0,饭送来是纯凉的，而且是拌好的…看着没食欲
0,送餐时间太慢
0,七喜送过来就少半杯了！
0,10点下的单，要求11:45送过来，结果12:45才送到，中间催单两次没反应，打400也打不通。快递小哥很朴实，12点多才拿到饭，然后风风火火爬步行梯到15层送过来，辛苦了，但餐厅做饭也太晚了吧！！！粥和肉卷味道都非常一般，等的快饿死了
0,一般，送餐态度不错
0,"11点定的餐，13点送到，你们还能再慢吗？？！,送餐人员态度差"
0,打了n个电话，n个人跟说我在送了，然后两个小时后被告知，我的订单落了，压根还没做，我真的是*******~
0,一般。名不副实。不会再订了。
0,送错咖啡了，注明豆奶拿铁没有送
0,量很少，还可以
0,等了一小时，感觉量略少，一个女生勉强能吃饱，偏偏我是饭量大的女生
0,面整个是一坨，没法吃，差不多一个半小时送到
0,"没别的味道,都是酱油味"
0,越来越小了。。。
0,时间太不给力了。两个多小时。。。一定要改善。不然没人买了。
0,粗心大意的！光送的菜。米饭可能厨师饿了吃了？？
0,十点叫的，两点多才到，打了好几个电话，都没下文，也不回电，
0,饭菜做的不错，送餐速度有些慢，要是能快些就好了
0,送餐太慢，导致粉都坨了
0,"时间一长,没送到就特别不好吃了"
0,太咸了，辣椒里面不知道有什么东西，吃了好几次都像石子的东西。
0,非常一般，还不给够发票
0,"要了超大杯，却给我大杯，但是还是很感谢骑手大叔，,这么冷的天气，"
0,我觉得简直就是个坑，180的菜，我气死，够二个人吃
0,尼玛，送了三个小时
0,"不能再凉了,我点了不要辣，辣辣的青椒会不会太多了…哭昏"
0,面不好吃！送餐服务不错
0,"点了两个米饭,只给了一个"
0,送货挺快，但味道不如以前的好吃了！
0,粥不错！！！
0,火锅店的炒菜。。不敢恭维
0,本来迟到了还自己点！！！
0,等了一个多小时，菜量少，尤其是那份拍黄瓜，又少又难吃
0,不太喜欢这个盖饭，还是卷饼比较好吃
0,"配送师傅非常,但是我点的冰摇红梅黑加仑送成了柠檬茶！"
0,菜量太少，味道还可以
0,味道值三分，服务零分。
0,小炒肉整成回锅肉~~~~~、
0,两个小时才送到，期间也没打电话说明情况，必须差评！
0,速度太慢，要是太远派送时间无法保障，就不送好了
0,菜量太少了，不够配米饭的
0,送餐慢一个半小时，菜品温凉不盏。这是一家卖面的餐厅，面都坨了！根本不能吃！两份说附汤的，结果只有一碗汤。很不满意的一次外卖感受。下次不会再光顾这家了。
0,味道还可以，就是这送餐时间2个多小时才到，也是醉了！
0,米饭还收餐盒费，哎，你们商家，真应该考虑一下，把菜品做好的同时，也把这些能省的省掉。
0,炒饭好硬，豆角太老
0,十一点40多时说15分钟后到，结构一直等到快一点。
0,汤横着就送过来了，撒到处都是!
0,不错，以后还订
0,第二次了，没有番茄酱。送错餐也是多次！
0,完全不符合传说中的“好吃”，完全凉的，京酱肉丝只有甜味，失望
0,牛肉汤不正宗哦
0,感觉全部都是甜面酱，太甜了，饼太厚，菜的汁水流了一手
0,"1个小时还没送到！又不是饭点！,不小心点了确认送到的按键怎么撤?！！！！"
0,没饭了还是不想送了呀。我们十点半点的餐，你们十二点打电话告知我们点的餐没有了，什么人啊，不想送也不能耽误我们店别人家的，我看你们干脆倒闭算了，气死老娘了。差的我都不想再说你们什么了
0,还可以，鸡肉太辣了…
0,到的时间比约定晚20分钟，菜都凉了。不好
0,送餐实在太慢了，整2个小时，辣菜也不注明，失望
0,快递再给力也没用，饭太难吃。。。
0,"单子竟然被转派了，,联系标注了电话的送餐员很不负责。,后来送餐来的人态度很好，,虽然迟到了很久，但是解释了原因。"
0,除了时间慢没别的不好
0,"我住在北京科技大学里面,不到500米距离送了1个半小时。菜基本凉了,而且洒了一半,弄得我手上,钱包上,桌子上全是油。做的再好吃也是差评"
0,送餐少送一根烤肠
0,点的果仁菠菜，送过来是木耳，你没有可以提前沟通，说也不说直接扔过来是神么意思？根本就不是正宗山西刀削面，卤蛋、豆腐一点味道没有，炒鸡蛋面就不说了，黏的一塌糊涂。
0,一个多小时，时间太长了
0,我要的是排骨饭，结果送的是鸡肉饭
0,一有点慢，吃了下午就拉肚子了
0,菜量比在店里吃的少很多，大家注意吧，谨慎下单！
0,就那么几步路远等了一个小时！！菜还咸的要命真是醉了，再也不想来了
0,酸菜太酸了，肉一半以上都是肥的，下次不会订这个了
0,超级差，都快两个小时了没送来，我定的是晚餐吗？？电话也打不通，定他家的饭能等出胃病来！已经打客服差评了！
0,盒子很精致，味道还好。整体不错
0,皮蛋瘦肉粥不是熬出来的粥，是白粥上撒料，美味。葱油面没什么味道，就肥肠米粉还可以，不太满意。
0,送到全凉了，从下单到送达一小时，整整一小时！
0,点了卤肉饭，结果来的是肥肉，超多饭，很干，不好吃，下次不要再叫了!
0,我该怎么评价？？诺大的盒子……只装了半盒……3块钱一份的鹌鹑蛋只有2颗……我忍了……好歹你给我放了！！！问题是我要的豆皮呢？？？我要的苦菊呢？？？里面绿色的菜叶我用一根筷子就能挑起来……3块钱一份的宽粉……只有中指那么长？？太垃圾！！！谁点你们家外卖谁死全家的！！百度优惠完还30块钱呢，这么大的盒子只有半盒不说……去了汤还剩什么？？垃圾垃圾垃圾垃圾垃圾垃圾垃圾垃圾垃圾垃圾……一条宽粉，两颗鹌鹑蛋……黑白各一块百叶……还有一支筷子就能挑起来的菜叶组成了半盒麻辣烫！
0,豆腐脑好吃，这款煎饼有点儿怪
0,2小时后送达，订餐需谨慎
0,十点多预定，还是没有准时送到
0,说了送发票，一直没送，有这样的吗？以后再也不订了
0,蜗牛的速度
0,饺子本来味道不错，也不是第一次订了，但是这次这包装弄成这样太气人了，一种馅的饺子我要了好几份，竟然全都装在了一个盒里挤着，到我这的时候饺子都被挤的分不开了，拿筷子一夹就烂了，倒出来以后就是一个包装盒的形状，分都分不开，就不能多装一个盒子么，本来饺子这种东西就容易陀在一起，这么多饺子还挤在一个盒里，到了我这还能吃么
0,"晚到了半个小时,汤都漏出来了"
0,"不错,量多。能吃饱"
0,配送太慢了！没拿到餐就在楼下确认订单了
0,"不好吃,全是面"
0,速度太慢，备注完全没理会
0,非常难吃，鉴定完毕，不再从此家订餐了、
0,"拌饭不怎么好吃,可能我吃不惯吧,鸡块还挺好吃的"
0,送餐的没素质！整体评价太次！以后再TM不再这上买东西了！恶心的服务！
0,香肠炒饭太烂了。。。又少香肠不超过3片
0,没有想象的多
0,就那么回事吧，两个菜都油乎乎的。每点一个菜还要收餐盒费
0,以后送饭的能不能到了再打电话？特么每次接到电话下去得等5分钟以上是什么意思？
0,菜品做的不好
0,菜里吃出了不该有的东西！
0,晚了一个小时才到
0,别的不说，就这速度也是醉了！做不到一小时就别写嘛！幸好不是等着救命的药！
0,全部都和到点现在买的不一样，基本没有茶味，和白水一样。送餐小哥特别及时！
0,太难吃了，吃到最后碗底有蟑螂，恶心死了
0,少了两个蛋
0,送餐速度比蜗牛还慢，100分钟才送到，而且要求不要放的蔬菜也往里面放，态度也不好
0,送的超慢，煎饼这东西时间一长肯定难吃，豆腐脑还可以。
0,"怎么就交易成功了？我都退餐了，我都打电话打到400了，怎么不退款给我,这平台怎么搞的"
0,个人感觉很一般，家人都不吃
0,实惠，但是厨师技术有待提高
0,送外卖的态度差
0,送餐速度极慢！不建议外卖点这家
0,等了两个小时，从不饿等到怒饿！送来的时候都凉了，不带这么欺负人的！
0,真心没什么优点可说的。
0,送餐时间不准。催单电话根本没人接，也没法取消订单。
0,"送的很晚,味道一般版"
0,商家没有给赠送的饮料
0,牛肉的筋太多，味道还行，不过价格摆在这里，挺公道的了
0,送的越来越慢~不准时。。。
0,烤鸭太难吃了，根本咬不动，不过百度外卖很给力，取餐速度超快
0,饮料洒了一半在袋子里，连吸管都没有，豆腐脑盖子上也全是油，煎饼因为太久捂在袋子里完全不能吃了，失败的一次订单~
0,香肠炒面不好
0,撒的整个袋子里都是
0,点的配菜一样都没有，不知道商家是怎么回事，一点诚信都没有
0,10点多下的订单12点半还没送到，建议soho现代城和建外soho的小伙伴们以后不要订他家了，估计是做出来等凑够一定数量才送的，也好意思叫“正时送”？饭菜都是凉的了，五花肉凉了那种腻腻的感觉，你懂的。另外百度外卖以后也别用了，补贴多但是不是涨价就是饭菜量抽调，对这些没法按时送的也不管理，根本不无法保证消费者的利益
0,"凉菜的盒子竖着放,凉菜都洒到包装袋里面了"
0,下单开始等了两个小时都没送到。多次打电话催，告知只能等，中间还有一次直接挂我电话，然后就不接。最后打通说可以退款，不知道会不会退。忍不了出去吃完回来才送到！只能当晚饭吃了
