label,review
1,我打神速还不行，非让我凑十个字才能发
1,价格实惠，味道也不错。
1,菜量很大，味道也不错，师傅速度很快，好评～
1,送餐很快，量足，很好吃，方便，个别菜不是很热，联系送餐时再现做。
1,快递员，好给力啊，太棒啦
1,不错，送餐及时，还会再光顾的
1,送的太快啦
1,鸡丁有点儿咸没有在店面吃的好吃有甜味
1,"还可以,有点干。"
1,味道不错，就是有小菜没有筷子不是很方便
1,好吃好吃赞赞！
1,特别幸苦，特别感谢！
1,好吃，送餐还快
1,很好喝！天天都喝～～
1,料很足，味道也不错，就是包装怎么那么复杂？！
1,好吃，这个评价够了吗
1,配送非常迅速態度非常好给个赞
1,很大！吃的好饱
1,"本单由,百度,配送并提供售后服务"
1,速度快，服务好，菜品更佳
1,"送餐超快,面不坨,味道好"
1,菜还行就是油有点大。送餐小哥不错萌萌哒.
1,味道不错呀，鸡翅好吃！
1,微波炉加热后，超好吃
1,一直很满意，尤其是配送服务
1,习惯好评，但今天的卷饼菜太少了，皮感觉有点厚了
1,"送得太快了,快哭了"
1,挺好的，油稍微有点多。
1,看着很干净
1,量足味儿美！
1,味道不错，份量够足，速度也快，态度好。
1,新年第一天速度依然超级快
1,"百度骑士很快,餐送过来时还冒着热气,赞一个"
1,我记得我是选择下午4点半送的，结果不知道为什么变成了1点多就送到了。鱼香肉丝盖饭好吃，皮蛋粥也好吃，赞赞
1,送餐速度超级快！这次订餐好成功，点的菜都好好吃。服务态度也好，牛蛙不够了给打电话确认加了大虾。
1,不太好吃…
1,速度真快！饭菜好！我喜欢！
1,太香了，太大了，全是肉，嘴唇都撑裂了
1,虽然等了一个多小时，但确实因为天气热，外卖小哥送不过来，辛苦辛苦，好评
1,姜蓉鸡，新菜，味道也不错。
1,饭菜香质量好，服务好，送饭快。
1,啊我点了这么多次吗
1,还不错，就是打包影响美观。
1,非常不错，很好吃
1,我说辣一点是在凉面里。卷饼里的全部都是辣椒超级啦只有两片都是肥肉。啦的我喷火其他还好啦。吃了你家很多次了怎么能这样伤人心啊
1,就是不能按预定时间送达.....要么晚四十分钟要么早近一个小时.......
1,不错，好吃不贵，送餐速度快
1,配送速度很快，东西也好吃。
1,要是快点就好了
1,很快好开心
1,很好吃，送餐速度也很快。
1,饭还挺实在给个好评送餐挺快
1,东西很好吃
1,卷饼不太好吃哦
1,这次很快，不错，赞了！
1,速度很难，味道还不错
1,不错，送餐小哥对不起了，打电话不知道怎么了没响～
1,非常满意，送餐员态度很好
1,送餐很及时，态度也很好
1,好评！外卖袋子很不错哦~
1,两个能吃饱，但锡纸包得不合理，很容易咽下去！
1,"感觉香蕉布丁蛋糕不是很新鲜了。很硬。,其他还好"
1,超快！服务好热情
1,送餐非常的快，价钱给力
1,挺速度的，有效率。
1,包装好，味道也不错，就是粥有点凉，但卷饼太好吃了！
1,好喝，送的很快，百度外卖我最喜欢用了！
1,送的特别快，味道棒棒哒
1,"卤肉饭不要这么好吃好吗！！！分开放我很喜欢,盒子也很大,配菜真心很全面,酸萝卜胡萝卜紫菜花,泡脚。凉粉不是很辣,以后就翻你家牌牌了,哈哈哈"
1,"很棒,包装很好"
1,味道不错，份量很足，建议都点小份。红薯超好吃就是太烂了容易碎
1,唯一美中不足的，就是一点儿甜味儿都没有。
1,很不错，送餐很准时
1,味道很好，辛苦外送员了。
1,很好…送餐很快，菜也很好吃
1,"没有满减,不定了哼哼哼"
1,最爱挚爱马铃薯披萨，超好吃
1,口味很不错
1,一如既往的干净好吃。
1,非常赞。棒棒的。赞赞赞
1,味道不错，就是送餐慢了点。下面那个叶良晨网络看多了吧，幼稚儿童一枚
1,味道一般。没有想象的好吃。
1,速度非常快，味道也挺好，一直喜欢他家的皮蛋粥
1,肉卷料很足，粥量有点少，送餐较快。
1,超级快！还是热的，谢谢～
1,味道不错，配送非常及时，好评！
1,"鸡翅太坑了,那是小腿肉,好少的,菜量好少"
1,很好，本次也很快
1,挺快的，好
1,一如既往，好！非常满意！谢谢商家哦！
1,包子味美，孩子很喜欢。
1,味道很好，送餐速度也很快。
1,好吃！很新鲜！送餐小哥也很好
1,百度骑士冒雨前来，送餐及时，非常感谢
1,好吃，很清淡
1,最近一直订这家的外卖，相当不错，够味儿，快递小哥也是棒棒的！
1,好实在，还会来
1,蛋糕质量和味道不错，送货很准时
1,送餐小哥够速度！满意
1,挺好，没撒！
1,京酱肉丝不错，炒合菜粉丝太细，菜太少了
1,送货快，味道好！
1,今天来的很快，赞一个。
1,送过来披萨还是热的，一如既往的好吃，赞一个
1,赞，不过泡菜五花肉略辣了些，个人口味问题。
1,四季豆不干，外卖很快
1,肘子肉的很好，素的基本没有菜，只放了酱。送货速度还可以。不到一小时就到了。
1,土豆丝好吃土豆丝好吃
1,"味道还不错,送餐师傅很不错,牛杂略咸"
1,很好，很好吃量很足～～～
1,不错，速度快
1,肉好少，不过只花了四块钱，也不能期待什么
1,"百度骑士很敬业,给100个赞"
1,超级好吃，由于上一单送餐员走错路还送了个小果盘，喜欢
1,外卖小哥态度很好
1,快递员很辛苦！给个
1,挺好吃的，京酱肉丝里面全是汁水很不错，肘子也还行，吃了2个和一碗粥，勉强吃饱，感觉有点少，这个中号的有大约5*5*25那么大，大胃的可能2个不太够。
1,还没吃，送了一个小时，速度有点慢
1,用心做的饭菜就是好
1,发货速度较慢
1,"第一次定,挺好吃的,就是有点慢,可能距离有些远"
1,味道还可以，量也挺足的。不过现在是用代金券和支付优惠，如果单论单品价格就比较高了
1,比较好，非常准时
1,"NextDay推：“浮生若梦，恋恋风尘.人生总是一日难，一日佳.”,-,端午快乐！"
1,说好不要蒜的，结果两次都有蒜，简直太过分了！！！~~~以后不准备买了，有也不通知一下。
1,大过年的辛苦了
1,喜欢吃裹油条的煎饼，豆浆不觉得特别好。送餐特别快。
1,"非常准确,送餐员一百个赞"
1,感觉太油了
1,大份的超级大，里面好多大肉块
1,葱花饼好吃，一份不够吃有点。建议出大小份
1,送餐小哥很给力，大赞。
1,必须给快递小哥点个赞
1,送餐员服务很到位送餐速度很快，香锅也很好吃
1,很好吃，而且便宜实惠
1,非常不错，味道也非常好！
1,好吃、好吃。
1,都很满意！服务产品都没问题，稻香村外卖就是产品再丰富点吧。
1,卷饼特别好吃～
1,特别好！很快送达…
1,味道很好，分量足，好好吃
1,送餐越来越快啦！
1,速度很快，味道也不错
1,送饭很快，态度很好，赞，
1,好吃，就是牛蛙太少了
1,"这么快就到了,太棒啦"
1,谢谢骑士谢谢店家谢谢骑士
1,挺好的，送的很快，包装很好，肉太多了，吃不了也是醉了
1,饼硬，不太好吃
1,都上班了才送来
1,"很好,外卖小哥服务也很好"
1,多等一个小时，但是看到外卖大哥穿着雨衣还淋湿了，心里一下就没了怨言
1,等了两个半小时
1,再加点菜啥的就更好了
1,味道还行，送过来还是温温的，正好
1,快递给力，排骨饭和鸡饭全是肉，味道好，汤都拌饭了，一个女生吃不下一份。
1,口味偏北方
1,物美价廉！给的量挺大的，味道也不错，好评！(不是说现在手机APP下单送清至口香糖么？为什么这个百度配送人员没给我?
1,赶时间，联系店家提前送的，超赞
1,好吃，希望速度加快
1,味道很好！
1,买多了，肉夹馍没吃，好大一碗面
1,味道好极啦，送餐很快师傅辛苦啦
1,送餐小哥态度特别好！好多肉呀好吃好吃！可我以为是可以选米饭换卷饼的？还在订单里自信地备注了
1,配送超快，态度很好！饭菜可口！
1,我去，这个大份的还真是大啊，快20cm见方了。
1,非常不错，挺好吃的，物美价廉！！
1,"吃的挺好的,以后还会点别的"
1,百度骑士人好速度快！
1,送来都凉了
1,味道挺好的，在这要着重表扬送餐大叔，不但速度快，态度还特好好。
1,"送餐特别快,态度好,非常感谢"
1,服务态度不错，骑手辛苦啦~
1,很好吃，送餐及时！
1,豆浆撒的有点儿严重……
1,豆浆没有送，希望下次检查好再派送
1,速度挺快，感谢送货大姐！
1,麻辣香锅很地道，送餐及时，好评
1,一看就是年轻人搞得，有青春的味道，不过你那尖椒不要都集中在底部
1,很好吃，味道很好，若能有一点青菜就更好了！
1,首次尝试，挺好的。味道不错，包装新颖；不过量有点少，一个卷好像吃不饱啊……
1,经常来买，不多说了，
1,出门不便，一个订单，非常快就送到了。也就十几分钟。
1,又快又好，量足，经常吃
1,菜量很大，满满当当的，味道也还不错。
1,经过上次晚了2小时，这次超级快，20分钟就送到了……
1,百度台太便了，大赞
1,酸汤的牛肉面对我来说不够酸，总体都还不错
1,"还没有吃,感觉不错"
1,没想到稻香村也能送！非常好
1,中份感觉男生吃不饱
1,卷饼好吃，送货也很快，非常好，非常喜欢的一家店
1,送餐很快，4:30分提前送到，分量很足
1,非常快～辛苦了～很好喝
1,大冷天的，快递小哥跟热情，准时，辛苦辛苦，很感谢
1,量大，味好，速度佳
1,饭菜一般，快递不错，赞一个
1,速度很快，东西也不错，赞一下
1,"又好吃,又准时"
1,外卖师傅辛苦了！这么大风，送的很快！
1,"大风天,不容易,非常好"
1,牛肉汉堡超级棒
1,嗯，好吃，黄焖鸡真是吃一家一个味，我喜欢这个味道，棒棒哒
1,东西不错，就是送的太慢
1,"挺不错的，很好,就是说好的尖椒呢，结果是青椒，一点辣味都没有"
1,速度超快，赞
1,送餐员的态度真的特别特别好！而且这次速度特别快，煎饼的味道就更不用说了
1,卷饼味道很一般，饼皮有些硬，甜面酱太多了
1,味道很不错，快递也给力
1,给同事订的，还行吧
1,肯能距离有些远，配送的比较慢
1,捡了个便宜，搞活动正好看见了，味道不错，量也大。
1,送的很快，也很好吃，但是说了多给一些汤底，还是跟上次去店里买的一样
1,送餐小哥十分热情，服务超赞，一定要表扬这个送餐小哥
1,不错啊，这是第二次点香菇鸡肉卷了，依旧美味。棒棒的，还有皮蛋瘦肉粥，两个组合，价格非常便宜哈。
1,羊肉的好吃，牛肉的一般，如果肉里有点酱油就好了
1,每一样的很喜欢！会继续光顾哒
1,送餐速度很快，味道还可以
1,眉州东坡的菜名不虚传！好吃！
1,服务好速度快100分
1,"配送师傅十分给力，外面下着大雪依然很快送到，谢谢！,菜也挺好吃，性价比高，还会再来！"
1,味道超级棒！鲜香培根的好吃、料也足！炸鸡也都是鸡翅而且个头很大！大赞！
1,送货员很赞，很到位，在单位都送到房间
1,味道很好，就是手滑点成冰的了，悲剧
1,非常好吃，经典，必吃！
1,煎饼味道一般，没觉得有多好，也许是期望值高了。
1,很好吃，味道不错，谢谢
1,配送人员超有礼貌：）
1,好吃，送餐时间较快，服务态度好，赞。
1,非常好非常快支持！！！
1,快递人员很尽职，辛苦了！
1,准时到达，太给力了！
1,提前送达，味道不错，再接再厉！
1,神速度！太赞了啊！！
1,味道没的说，好吃！！！
1,不错，口味很好！
1,味道不错，价格实惠，好评
1,好吃，豆腐脑的盒子改良后比原来好多了！
1,"煎饼好吃,外卖速度快"
1,靠谱的一家
1,尖椒土豆丝不好吃，别的都不错
1,"真的很棒,没啥说的了,嗯嗯,棒棒的"
1,菜品味道还都不错，快递也很快！
1,外卖员名字跟我们家名字一样
1,"实惠,送餐快"
1,送餐快，菜品还是热的.服务也好
1,送餐速度还可以，饼很好吃
1,不错不错，胃不舒服才点的粥，清爽，料足。外卖小哥服务态度也是很棒
1,"飞速,南瓜粥没了换了皮蛋瘦肉也ok吧"
1,味道还是那么好，服务也很好，就是速度再快点就更好了
1,很好吃而且有优惠买完9块钱一个。超值。
1,谢谢师傅～送餐很快～辛苦您了～
1,去人大店吃过一次，服务很好
1,妈的连着两天没有筷子！！！百度外卖你们搞毛线！！！7，8个人的面。你让我们用手抓！？？？？？？？
1,鸽子鲜嫩，味道不错，送货及时。
1,鱼香肉丝的好吃，土豆丝的有点油
1,披萨很不错，薯条放久了没在店里的好吃
1,吃了两次了，卷饼可满意，其他的一般
1,奶茶好喝！送餐准时，到的时候还是热乎乎的！
1,生病在家点的餐，份量很大，味道也不错
1,"送餐大姐人可好了，特别热情,五星！赞"
1,"味道很浓,而且还可以换不喜欢的布丁,很灵活的店家,赞一个"
1,味道不错，送货快
1,味道不错(o^^o)♪粥很香甜
1,好吃，小哥每次都给爬楼梯，很赞
1,送餐很及时
1,"一直很喜欢他家的东西,味好,便宜"
1,配送及时，味道佳。湖北人必吃
1,"很好，速度很快,味道也不错"
1,这次的麻辣教父一点也的不辣诶。。。不知道为啥。。。
1,菜品味道好，师傅送货快
1,还是一样的好吃，全吃掉了！
1,非常好量足都没吃完
1,送餐员态度很好，效率高
1,很不错，加班餐定点，很好吃
1,吃了好几次，很好吃
1,快递师傅特别好，大冷天真不容易
1,"送餐师傅很快,可是菜品一般,感觉都不新鲜"
1,肘子卷好腻，吃完有点想吐……太油了，肥肉太多，没有太肚饿酱料调和一下
1,"百度外卖超快,有些菜没了，换的"
1,有一点问题，就是餐盒用的太多。没有必要
1,真心不错哦，特别好。
1,很好吃，忘记拍照了～
1,"速度很快,赞一个快的小哥"
1,送得很快，态度很好，菜量十足，实惠
1,"送餐很准时，包装太高大上了点。。。锡箔纸卷饼，牛皮纸袋打包,。来说说这个肘子卷饼，肥肉太多,我全挑出来了。。。味道还可以的,但感觉不像是肘子上的肉诶,皮蛋瘦肉粥很好喝,就是相比较其他家分量有点少"
1,排骨面很香，小白菜油偏大味道偏淡，灌肠不太好吃。
1,还不错~~包装袋子特别棒！还送的有一次性拼图~
1,"送餐很快,态度也很好,谢谢"
1,小炒肉太辣，其它还行
1,不错啊。快递很快，奶茶也还行。
1,米饭好丰满，吃不了，超实惠
1,土豆泥以前很好吃的，不知为什么这次特别干？！
1,很好吃，总爱点他家的饭当工作餐。
1,已经点过很多次了，每次都还挺好的，速度快，点两份能吃饱，好评！！！
1,帮朋友订的，听说不错
1,可惜不能更改杯型，又所有订单也不齐全
1,神速的百度骑士，超级好超级好超级好
1,口味不错，送餐小哥服务也很周到
1,"包装不错,味道也不错"
1,非常快，没有肉，估计是不在正餐时间的原因
1,拌面有点坨，味道很好
1,好吃又实惠，感谢快递员哥哥，
1,非常快，稻香村老字号东西味道都不错
1,好评啊，配送速度超快，这大雾霾天的辛苦啦~
1,已经在手机上评价过了，谢谢商家！
1,送的比较慢
1,大肉卷好吃！在便宜一些就好了
1,还可以，就是汁少了些
1,好吃，送餐快！
1,很用心的店！支持！
1,等收到的时候，卤煮是温的，饼是凉的。速度慢。
1,就是送餐好慢
1,非常好，快递非常不错
1,"送餐很快,煎饼还热气腾腾"
1,服务周到。很贴心。我喜欢。
1,不错，不错，用了券比自己去店里买便宜。
1,送菜及时！好吃！百度骑士辛苦！
1,锅仔酸菜炖腔骨怎么没见酸菜啊？只有青笋和腔骨，青笋也不是酸的。
1,煎饼很好吃！送餐很快！
1,送货小哥儿超级赞，萌萌哒，送货巨快！
1,不错很好吃.就是边有点硬，饼也薄了点，味道不错馅料也好
1,送餐很及时，菜品味道不错！
1,好吃到停不下来...好评！！！
1,非常美味可口，还会再来！
1,里面有蘑菇。总体不错啦
1,岩盐芝士绿茶每单必点
1,又快又好，态度友好，下次还会用
1,非常好非常好非常好～
1,送的超快！！
1,挺好的，送的也挺快的，米饭再好点就更好了，感谢送的coffee
1,非常棒，就是这送餐费略贵。这么近
1,第三次点了，送餐小哥这次送的很快，好像是店里的人，终于不是达达了，味道还是那么棒，希望每次都这么快，加油，好评
1,口味不错，速度挺快，还有手套送，想得很周到！
1,今天的牛肉烧烤饭，感觉牛肉有些不新鲜，送餐员的速度还是很快的。
1,用料十足，很好吃！
1,配送非常快，10分钟就送到啦～
1,味道不错，送餐快
1,安娜喝完很舒服，不腻。果汁很新鲜！
1,速度很快，味道也好，还赠送了粥，满意
1,晚了半小时左右吧……不过最近这么冷还是辛苦了，估计大家都不想出门吧。超级好吃！推荐！
1,送餐小哥很细心
1,小哥态度很好，两种饮料都很好喝
1,都很不错，鸡翅略微有点咸，不过还能接受。
1,芝士薯蓉烤过火了
1,我只能说，好！
1,要的鱼豆腐烤焦了。。。而且筷子只有一只
1,菜品选择再多一点就好了
1,快递很快，态度好，赞
1,喜欢宇宙卷饼，送餐也很快，很划算
1,十万个赞！最好喝没有之一！
1,"不错，常客了，肘子的好吃,送货也快"
1,送餐员非常到位，速度也很快，到时餐还是热的。馅饼超好吃，炒饭也不错，就是有点淡，也许是我口味重吧。
1,好吃，就是能准时送就好了，早点就早点吧
1,送餐很快，服务态度很好，还会再来
1,好吃！就是皮蛋粥有点儿太稠了…差点把锡箔纸吃进肚子里！呜呜…
1,天气不好，师傅辛苦了
1,眉洲的除了有些辣以外还是很好吃的
1,非常好吃下次再买不错不错
1,拌面真心好吃，煎饼口味有点吃不惯
1,卷饼真的不错！拌饭也还可以
1,今天晚上送的速度快，而且送餐小哥人非常好。比上次那个好多了，下午才送来
1,价格合适，面有些硬
1,商家因为某个东西售完直接取消了订单，就不能提前打个电话么，白等了半小时。
1,很好，热干面有点干了，但是是正常的，好吃。
1,很好，送餐也及时。
1,时间1个半小时了才送到，果然去店里吃和外卖东西不太一样啊…还有新奥尔良烤翅就跟没熟似的…但是榴莲披萨味道还是不错的！
1,"很满意！送餐速度挺快的（毕竟近,马路正对面），菜量没有堂食多。"
1,奥尔良烤翅中直接是夹生的，完全没法吃的节奏⋯⋯其他很赞。强烈推荐芝士土豆球和五花肉石锅拌饭！
1,那个麻辣拌素居然放糖…
1,百度外卖的袋子挺可爱的，送餐员服务也好。关键稻香村好吃！哈哈哈
1,"东西好吃又实惠,送餐又快,好评"
1,下雪天送餐小哥摔了，结果很快又重新送过来一份！
1,低价，速度快，味道好、服务好。
1,两个都很好吃，配送大哥人很好
1,送餐师傅很负责任，大冷天的不容易！
1,超级实惠，就是有点肥
1,就是有点慢
1,"味道很好,皮薄有汤汁"
1,送来的挺快的～味道不错
1,味道不错。酱香。蘑菇也很鲜
1,"挺好的,挺好喝的,不错"
1,挺好的，不错
1,说得再好也是假的，尝了就知道了
1,南瓜粥一般，没有南瓜的香甜味道！
1,很快，好吃
1,很棒哦，冷天吃到好吃的热饭菜，感谢～
1,第一次订，提前送到，吃了下才来评价，味道不错，好评
1,非常好！第一次用百度外卖，送餐很快，快递小哥也很礼貌。菜品量足，味道不错，下次再来。
1,很好吃。送货很准时！非常喜欢。赞赞赞
1,特别好吃，下次继续！
1,很好吃，就是粥有点不满意。送外卖的小哥也不错
1,百度师傅人特别好，送餐也很快。菜品味道也不错。满意满意。
1,豆皮还挺好吃的，热干面也还行
1,东西很好吃，送餐速度也非常快，只是窝蛋牛肉饭上边写带汤，可是没给~~不知道是不是忘记了~
1,小哥弄洒了奶茶，不过哈哈哈我并没有生气啦，只是故意调戏下～面辣辣的好吃～奶茶太甜了…
1,好吃，送餐员很尽职。
1,没来得及，品尝！但是快递员少找我一块钱！59.9的点心，我给他100他又要了一块，找了我40.05元！郁闷
1,还行，就是吃不饱，下次订大份
1,赞宇宙卷饼的送餐速度，感谢~
1,"特别快,感觉定完没几分钟就来了,送餐小哥很细心,赞一个"
1,这个好吃，大赞
1,"服务超级好,不错,很耐心很客气"
1,挺快的好吃
1,豆腐脑很淡，不太喜欢，猪蹄不错！
1,送的非常快，包装好！谢谢师傅！
1,超级好喝，快递小哥非常给力。
1,很快，包装很好
1,味道还行，锡纸包着，还能加热。皮蛋瘦肉粥做的很好比嘉和一品好吃。包装很精致。还有一次性手套，很用心了。百度外卖不能传照片。。。
1,配送很快，赞！套餐份量很足，味道很好，特价价格也很便宜，非常划算！
1,肉有点腻了
1,儿子最喜欢吃站点，昨天因为脚崴了不方便出门，只能外卖，其他都很赞，但披萨我觉得像提前做好翻热的，因为已经很硬，我们一直在亚运村店吃，一个披萨的烤制时间不短，昨天从下单到送来，时间不太对。
1,真的很好吃，送餐很准时
1,撒得一塌糊涂，味道不错。
1,味道还行，用百度外卖比到店里划算多了
1,好吃，荤素比例很好
1,"速度挺快的,赞一下"
1,好吃但是太咸了，其他都还好
1,特别实在，实惠，量大，良心餐厅。味道也不错
1,菜量挺大的！快递的速度太给力了！
1,迅速及时！好吃！百度骑士辛苦
1,一般，说实话没有我自己做的好吃好评吧
1,怎么觉得没以前好吃了呢
1,送来时有些凉了，感觉缺少了一些香味。餐盒路上坏了，吃时面里的汤没有了。
1,味道很好，送餐员态度赞
1,第一次定披萨，送过来很快，辛苦快递小哥了，还是热的，披萨最好吃，那两份小吃估计还是在店里会好吃点
1,粥还不错，饼还没尝，包装挺好，看着不错
1,还可以，家常味道。下饭
1,不错，配送速度快
1,香菇鸡肉盖饭很好吃
1,味道太甜了～
1,太吊，秒送...
1,很好，百度骑士师傅很好，很快速的送到，大赞
1,这饭太给力，吃不完都
1,味道不错，能看到送餐员的行踪
1,还可以，送的时间算快的了，半小时吧～
1,送餐包装很不错，而且送餐很快很及时。要了肘子卷饼和南瓜粥。卷饼味道不错就是尖椒偏多，如果是黄瓜之类的觉得更好。粥有一点凉了，总体很赞！
1,"牛肉咬不动,其他味道很好喔"
1,骑士辛苦了。app还是评价不了，很麻烦
1,口感不错，很好
1,粥挺好吃的，卷饼味道不错，可惜有点凉
1,"挺好的,不错"
1,说实话，中份吃不饱，得2个
1,这次不错，赞一个
1,非常好吃，包装很严密
1,味道好，价格也实惠，推荐南瓜粥！
1,味道还不错~喜欢有爱的包装~
1,味道不错，服务不错，
1,服务态度好，速度快，值得表扬
1,一个人吃量有点大，希望有小份的
1,送餐不是一般的快，简直神速
1,好吃，百度骑士非常棒
1,速度太快啦，很好吃
1,有点辣，送来时有点凉了，其他还好
1,酱有点儿多了
1,紫苏黄瓜油大了点。烧椒皮蛋醋多了辣椒吃起来发酸
1,非常不错，谢谢送餐的师傅
1,蛋糕美味，送来的速度超快。
1,第一次用，感觉很好！
1,送餐很快，送餐人员很热情！～
1,肘子卷饼肉很足。就是我口味重不够咸
1,很好吃，但是外卖小哥就停在学校门外了，而且态度差一直催
1,快递阿姨很好，速度快！
1,非常实惠，不错！
1,"很好吃,特别快就到了"
1,"百度骑士,非常好,！"
1,送餐员辛苦！奶茶味道不错！
1,还行，中份不算大，够一个女生吃，油太多了
1,很好吃，就是量少了一点，男生可能吃不饱
1,豆浆挺好的
1,味道不错，就是瘦肉再多点就更完美了
1,今天送的挺早。。。。。。
1,姜太多了，有些吃不适应。
1,菜品质量很好，吃货几次了，都还不错
1,神速，继续支持。！！！
1,东西非常好，还是热的，辛苦了！
